Tag,Username,Blue,Description,Birthday,Joined_on,Is_profile_public
lawrencejanice,thomasjessica,False,Event now home yet.,2003-06-13,2020-01-31,True
mary95,mwoodard,True,Threat candidate indicate.,1946-10-27,2022-03-03,False
williamgarcia,dorseychad,False,System tree lot.,1951-06-23,2022-06-11,True
qwright,sara85,True,After name wear check record.,1984-01-02,2022-08-21,False
stephaniehoward,richardthompson,True,Whether yeah ability floor.,1989-04-26,2020-07-20,False
gregory68,sphillips,False,Win that station.,2005-06-12,2020-08-24,False
erikhernandez,cjohnson,False,Want paper difficult clearly.,1992-10-18,2022-05-17,False
dean21,brandonsingh,True,Brother stuff him tend.,1976-08-17,2022-09-03,True
njackson,veronicaharris,False,Together order image gas.,1941-02-11,2022-06-24,False
cdiaz,monica89,False,Fire until despite bar.,1980-04-06,2021-02-04,True
melissasimpson,shannondavis,True,Across place people resource.,1984-08-31,2020-12-05,True
wbarnes,schmittmary,False,Fall how economic.,1942-01-23,2024-04-14,False
michaelgood,qquinn,True,Trial ground less sign spend.,1988-07-18,2022-11-10,False
adam56,jonpeters,False,Seat middle sort recognize.,1978-02-22,2022-04-13,False
rebeccaparks,gstanley,False,Surface surface similar test.,2002-01-26,2021-02-02,False
williamsbrittany,groy,True,Follow peace early college.,2002-02-26,2023-02-11,False
robertnichols,lawsonrenee,False,Tax benefit see husband fish.,1990-09-07,2020-10-13,False
stephaniemontgomery,saranelson,False,Tell same type case.,1981-04-23,2020-02-23,False
kelli95,richardsonscott,True,Indicate test amount.,1998-07-07,2022-04-05,False
joshuaclark,henryjon,False,Find feel rule.,1943-03-02,2023-07-24,False
mcarey,johnsonlaura,True,Speech yard exactly degree.,1961-12-16,2020-11-04,True
jessicadunn,bflores,True,Something weight month more.,1942-10-27,2023-11-16,True
davidramsey,mcastillo,True,Ask process energy.,1963-06-23,2022-06-05,True
uthomas,smithjohn,False,Make or become.,2001-10-03,2020-12-30,False
paul82,patrick44,True,College institution need win.,1980-01-27,2021-03-05,False
melanie25,amanda14,False,Campaign work realize part.,1953-12-14,2020-07-21,True
laurenfisher,sandra29,True,Executive family deep.,1978-12-15,2023-12-17,True
whitakerkelly,cindy16,True,Nor leader through make.,2000-06-26,2020-06-17,True
greenjoseph,jennifer79,False,Paper attorney no fall.,1985-09-11,2021-09-13,True
youngtroy,mariobrown,False,Safe he among back.,1952-09-01,2022-05-07,False
pjones,heather79,False,Baby whom form thought real.,1963-09-04,2021-03-19,False
hwarren,luisjohnson,True,Might build edge would.,1990-05-07,2023-12-19,True
fullersara,marcus08,True,History man woman data board.,1992-03-24,2021-08-08,True
richard55,katherineanderson,True,Son bag high plant throw.,1954-08-20,2024-01-26,True
ywalker,watkinsmary,True,Side green fill key.,1985-08-30,2021-11-05,True
aaron93,fchavez,True,Reflect court be race baby.,1942-08-21,2022-01-31,True
billy57,jmejia,False,This both across.,1995-01-29,2023-06-27,False
blanchardbrian,triciasimmons,True,Long personal media risk.,1961-04-21,2020-11-21,False
hallen,kelleygeorge,True,Rock character lawyer best.,1977-03-12,2024-02-20,False
ricegeoffrey,lindsay56,True,Appear capital begin play.,1960-12-30,2023-07-06,True
wardcynthia,hensonjessica,False,Turn beat nice opportunity.,1954-08-12,2023-01-31,False
josesilva,erinbaker,False,Worry must data.,1940-05-04,2023-05-28,False
joel97,sandersmegan,False,Somebody tonight style wish.,1963-06-25,2022-05-09,False
klopez,reedlogan,False,Rich trial suffer better.,1973-11-21,2020-12-08,True
howardrobert,bryanyoung,False,Down sit support thing.,1971-02-06,2021-11-24,True
pamelabrown,cbaker,True,Need buy anything once grow.,1966-09-02,2020-04-24,False
barkerjaclyn,acevedosteven,False,Method near west memory.,1996-09-01,2023-11-03,False
parkkathryn,vramirez,False,Represent last turn past off.,1992-10-18,2021-01-12,False
hcannon,gpalmer,True,Skin treat change lay class.,1985-10-02,2020-03-01,False
vgray,david32,True,Thought his stay where note.,2002-07-12,2020-11-27,False
ehawkins,jennifer41,True,While wrong tough full rich.,1986-03-17,2023-07-10,True
jamie54,florestom,True,Talk feeling game court.,1949-06-03,2020-10-24,True
hhouse,nperry,False,Pretty concern believe local.,1995-08-01,2020-11-17,True
hweber,idiaz,True,See occur mention position.,1996-03-13,2022-03-28,True
lherring,jenna93,True,Almost dog think.,1996-01-17,2023-10-01,True
wpittman,gharper,False,Care place case.,1947-10-14,2024-02-05,True
donnabauer,andreaboyd,False,Prevent and just successful.,1963-08-06,2020-12-13,False
crosbylauren,pleonard,True,Ability another prevent.,1938-11-30,2022-01-14,False
hhancock,pmiddleton,True,Create strong one require.,1990-11-03,2023-02-11,True
aguilarthomas,newtonkayla,True,Wall suddenly Mr father.,1946-06-14,2023-09-06,False
williamsjames,curtismichael,True,Move since music lawyer.,1976-02-26,2020-08-12,False
megan48,cmcgrath,False,Statement little become.,1957-06-29,2024-01-09,False
alex21,charlesrobinson,False,Who president anyone listen.,1960-09-03,2021-10-24,True
millerlindsay,akelly,True,Black traditional defense.,1999-07-19,2023-04-01,True
johnscynthia,ramirezjeremiah,True,Third compare few find.,1964-05-21,2021-12-25,False
xwilliams,sandy99,True,Hard amount country various.,1997-11-30,2023-10-10,False
juliebrown,othompson,True,Onto because protect.,1983-10-17,2023-11-21,False
jjordan,steven79,True,Memory put system.,1993-03-24,2021-09-05,False
keithlauren,david55,False,Southern he under three.,1961-11-18,2023-03-16,True
mlopez,hayeshaley,False,Time right here far front no.,1981-12-01,2022-06-15,False
zromero,udominguez,True,Heart yard story across but.,1984-07-23,2022-03-07,False
samantha92,warren39,True,Chance can personal fine.,1951-01-08,2023-01-16,False
howardchristina,williamssusan,True,Impact receive indeed dog.,1981-07-02,2021-06-18,False
fmcneil,howarddawn,True,Add hotel benefit water.,1949-09-04,2024-02-11,False
breanna87,holly71,False,Agency local lose kitchen.,1939-08-11,2020-09-10,True
devin90,clinespencer,True,Must share forward measure.,1955-04-13,2024-01-03,True
kellyjohnson,marylarson,True,To reveal like society same.,1944-03-07,2020-08-04,True
gibsonkenneth,khickman,True,Study think marriage.,1977-08-22,2023-11-08,False
dennis83,eryan,False,Life possible imagine.,1990-04-18,2023-01-05,True
donnaespinoza,thomas31,True,Home evidence really speech.,1958-01-12,2021-11-03,False
hinestyler,yflores,False,Goal focus mention that eye.,1970-12-30,2021-11-11,True
collinsjocelyn,dianasteele,True,Bit treatment policy.,1988-09-08,2021-03-28,False
arthurwatson,yturner,False,By impact each family.,1939-06-28,2024-01-16,True
benjamin37,schmidtmichele,False,Company citizen scene.,1998-06-05,2024-04-10,True
higginsbrittany,michael34,False,Forget order every world.,1949-04-19,2020-02-13,True
charlesmatthew,brownjacob,False,See tax husband son.,1956-04-25,2024-01-23,False
xdavis,reidlawrence,True,Along lose hot.,1997-10-31,2023-09-28,False
mitchell08,ronald91,False,Four true speech there base.,1961-04-25,2023-07-13,True
david40,monicastevens,True,Arrive nice degree really.,1940-06-03,2022-10-01,False
daniel28,emurray,True,Watch management end piece.,1988-05-23,2020-03-16,True
thomasangela,plambert,True,Need summer however citizen.,1958-10-11,2022-02-03,True
koconnor,wilsonleslie,True,Success movie throw.,1970-07-01,2023-08-06,False
mdavis,hollywilson,True,Church local where.,1946-07-23,2020-02-25,False
emilymiller,nmueller,True,Human if its lawyer.,1966-05-08,2023-01-05,False
margaretmartinez,lee47,True,Bag involve difference maybe.,2000-01-30,2021-02-16,True
cherylmercado,veronicarose,False,Cultural call since partner.,1997-02-02,2022-03-23,True
crawfordethan,chaneyandre,False,Film soldier agent ball.,1939-02-28,2023-04-05,True
dianadavis,leebryan,True,Hair probably include should.,1994-04-27,2021-08-15,False
perryvincent,anthonybradley,False,Coach break learn.,1952-12-16,2023-04-27,True
xgreen,michaeljohns,True,Area all debate heavy.,1992-01-26,2021-08-09,False
hvillegas,victoriasanchez,True,Land Mrs now.,1976-08-12,2021-04-02,False
fryejavier,amandawest,False,Write how want unit.,1988-09-22,2022-09-26,False
martinkara,edwinolson,True,Assume give next.,1941-07-05,2021-06-09,True
osmith,davidholloway,True,Artist mean between.,1984-08-01,2023-06-04,False
chavezbethany,teresa63,False,Yet difficult social type.,1999-09-19,2022-07-16,True
jacquelinedecker,pennyguerrero,True,Against two large color lot.,1949-02-14,2021-05-01,False
imitchell,vmichael,True,Among artist gas notice.,1959-09-19,2023-05-22,False
tperry,leslieklein,True,Explain old because others.,1969-08-22,2022-01-11,False
suzanne03,yvonne19,True,Her serve spend.,1979-08-19,2022-10-04,False
jonathan25,staceydiaz,False,Able next book season.,1963-02-03,2021-02-11,True
rachael49,caseystewart,False,Unit physical tonight.,1997-10-22,2023-11-03,False
ymorgan,gregorybarrera,False,Another have loss section.,1957-05-19,2023-05-06,False
timothy56,john97,True,Officer us head.,2001-05-10,2022-06-15,True
andrew25,louis09,False,You turn thank girl.,1986-10-24,2023-09-07,False
alarsen,vhernandez,True,Computer near order clearly.,1986-05-12,2021-11-28,False
pmiller,jeremypowers,True,Answer anything behind I.,1970-11-01,2022-10-06,False
sanchezjohn,michael09,True,Local day water.,1996-04-19,2023-04-15,True
fdavis,nicholsfrancisco,True,Food reflect his.,2003-03-26,2020-03-23,False
amandamitchell,kelly03,True,Democratic its theory.,1966-02-16,2020-07-30,True
jmorgan,davidsonmichelle,False,Both student nature.,1974-05-29,2021-08-11,False
faithfox,davidcruz,False,Standard almost factor stand.,1962-11-08,2022-01-05,True
loretta13,boltoncody,True,Final least their here bring.,1944-12-18,2022-01-02,False
coreymartinez,suzanne53,True,Particularly build road.,2000-09-25,2023-12-30,False
christensentammy,david72,False,Care dog decision.,1950-02-10,2023-03-23,True
donaldsonvickie,uadams,True,Open serious eye money.,1983-05-11,2022-06-11,False
trevorgibson,jamesnguyen,False,Message detail research live.,1977-06-07,2024-03-25,True
donnagraves,turnerchristopher,False,Activity production claim.,1965-05-13,2020-07-22,True
hmedina,irobertson,False,You dinner imagine film.,1940-07-15,2022-01-29,True
michael33,marcstevens,False,Reduce along clear.,1957-06-16,2024-03-16,True
gregbullock,reedwilliam,True,Again his data.,1972-02-17,2023-11-05,True
mfrank,stanleymills,True,Music Republican now finally.,1947-03-27,2022-08-16,False
bjennings,hhoward,False,Learn yeah hospital act hot.,1958-07-14,2021-04-27,False
kbaker,susanhartman,True,Amount worker response stay.,1992-12-18,2021-04-13,False
joseph33,brandibaker,True,Run board the drop.,2001-02-18,2024-04-13,True
stephen70,wilsonstephanie,True,Your hear to remain myself.,1971-04-27,2020-01-24,True
burnsheather,hlewis,False,Very perform member protect.,1992-03-31,2020-10-14,True
williamschristina,alexandermatthew,False,Trip eight first.,1969-08-31,2022-08-31,False
fthompson,carol16,False,Every especially meet enjoy.,1981-12-27,2023-05-23,False
hernandezpaul,stewartmichelle,False,Field animal case.,1941-06-21,2022-03-25,True
savannah29,marshbrian,False,News whatever provide call.,1992-11-25,2023-12-03,True
harriskathleen,joe84,False,Natural whose song.,1973-04-29,2021-10-17,True
baileypaul,michael56,False,Deal natural evidence.,1978-12-28,2020-05-06,False
qbarrett,david23,False,Executive hard once happy.,1943-09-27,2020-02-17,True
tomlarson,traviscox,True,May with alone cultural.,1965-05-21,2021-01-05,False
jonesalexander,mark98,True,Window reach professional.,1967-07-09,2021-08-12,False
gwolfe,bradgilmore,False,Let herself avoid follow.,1946-12-25,2023-05-30,False
grivas,grimesdean,True,Agency trouble meet together.,1977-03-06,2022-01-22,True
qvaughn,hjensen,False,Mind skin simple.,1949-11-03,2021-12-15,False
casemichelle,taylor48,False,Home raise let measure food.,1958-10-08,2021-04-13,True
doughertytracey,aaronmarks,True,Cell lot still.,1990-10-26,2023-10-23,True
leah64,robertsmaurice,True,Tree field town add.,1978-12-23,2020-10-14,False
leah70,vshepard,True,State bank now artist tree.,1996-08-11,2023-03-01,True
shawn61,chunt,False,Kind after along boy.,1951-06-13,2021-08-14,False
joseph87,shortdarryl,True,But trade staff life.,1987-05-26,2022-09-05,True
qwilliams,vanessaschultz,False,Laugh coach central college.,2001-01-02,2020-02-26,True
nwoods,rogersjohn,False,Line amount part dog.,1990-01-15,2021-07-17,False
barbara32,raymond33,True,Meet life himself economic.,1988-11-16,2021-11-04,True
deleonstephanie,kimberly56,False,Must their pressure free.,1962-10-22,2023-07-03,False
icalhoun,kathyrodriguez,False,Focus focus others chair.,1956-08-29,2020-11-17,False
karen83,greeneemily,False,Of role do food low.,2000-11-23,2024-03-04,True
christopherlopez,ycline,True,Guess concern throw common.,1972-04-06,2023-07-09,False
ypatel,christopherknight,True,Learn high expert.,1957-09-22,2021-12-04,False
rachael26,bernardmcmahon,True,Relate time hot require.,1980-03-10,2021-05-03,False
robert05,krobinson,True,Study unit game lead get.,1988-05-09,2024-02-28,False
josephgutierrez,gonzalezthomas,False,Real couple pretty enter.,1997-11-11,2024-01-19,False
nicholaswelch,deanmatthew,False,Security vote say.,1958-06-02,2023-07-25,True
yhammond,srussell,False,Partner health audience.,1977-10-09,2021-02-18,True
barbara98,daniel33,False,By lawyer expect officer.,1997-07-19,2023-10-16,False
nicole65,curtis79,False,Response room follow white.,1949-03-29,2021-08-31,False
xcarter,jaime37,True,Rate clear church game.,1982-04-06,2022-05-13,True
berrybradley,michael69,False,Expect everybody want family.,1985-08-25,2023-04-08,False
mooneyjoshua,danielperry,False,Low send leg card main.,1938-12-28,2021-01-14,True
ssimmons,icurtis,True,Pressure bit law.,1958-06-21,2023-01-19,True
michaelwilliams,youngeric,True,Letter pick lay south.,1944-09-15,2021-05-06,False
adamfuller,odonnelllindsey,True,Real piece say reach artist.,1983-02-14,2022-07-11,False
wcarlson,dgiles,True,Seem at teach civil.,1971-12-12,2020-10-17,False
sandersdavid,dorseythomas,False,Popular arm word into.,1966-07-03,2024-03-15,True
slopez,davidgarcia,True,Level business large easy.,1991-10-10,2020-04-30,True
lnunez,james69,False,Range teacher know.,1951-02-25,2021-11-04,True
ndrake,beardkristine,False,Stock hit television site.,1993-10-28,2020-02-15,True
gdaugherty,lauren63,False,Take reach report answer.,1952-07-28,2020-05-14,False
jamie85,jeremyjohnson,True,Federal hold picture boy.,1985-05-03,2024-03-21,True
shawnhudson,jerry15,False,Place plan respond including.,1979-01-06,2021-03-17,True
xholden,bbarber,False,Because just sort expert.,1997-09-02,2022-03-19,True
brittney42,john14,True,Attorney along guess explain.,1975-03-01,2022-06-05,True
dianerichardson,mario28,False,But cost former however miss.,1992-02-27,2021-04-04,True
carrie46,mariahcox,False,Page wife east argue court.,1989-06-12,2024-03-18,True
dennisrobinson,maldonadojoshua,False,Science let population.,1978-10-22,2023-05-14,False
vmorris,baldwinjacob,True,Quality player answer.,1997-11-08,2022-09-07,False
julia91,wallacekimberly,False,Develop side their certain.,1972-03-18,2021-11-27,True
wsimmons,jensensabrina,True,Maintain provide the money.,1941-08-17,2021-09-25,False
lisascott,karen88,True,Phone cell trade fall.,1980-07-08,2022-03-11,True
katherinecarter,dmyers,False,May such mother whom.,1973-07-03,2022-07-21,False
dpope,floresmichael,True,Friend play pay.,1960-05-04,2023-04-14,False
xwright,paul67,False,Audience because analysis.,1975-10-12,2021-05-17,True
ibarrajustin,tbuck,True,Represent believe account.,1947-09-18,2022-08-17,False
donna43,annagarrison,False,Myself door meet line.,2001-12-20,2024-01-21,True
chasemark,cynthia52,False,Entire great use.,1993-12-02,2023-11-22,True
john74,patricia76,False,Dream respond yourself group.,1985-08-05,2023-11-01,False
mckinneylonnie,vduarte,True,Often seat crime.,1992-12-01,2021-03-09,False
kathrynglenn,carlajames,True,Point pay wait per.,1953-01-25,2020-12-19,True
danielle28,douglas02,True,Front in great test.,1948-05-18,2020-10-05,True
fcastro,frank47,True,Air today receive level.,1964-05-26,2021-07-11,True
lindseymatthew,justinwatts,False,Draw arm sit view single tax.,1983-07-15,2023-06-25,True
andre00,bwong,True,Can community discuss order.,1973-11-22,2020-05-22,False
jameshill,copelandjustin,False,Between event student bar.,1995-05-24,2023-07-02,False
awagner,boonecolin,True,You study speech economic.,1991-11-27,2020-03-05,True
sconley,lflores,False,Break turn later key.,1957-12-14,2022-10-16,False
steven57,sabrina33,True,Whole summer suffer.,1980-05-28,2020-06-14,True
asteele,joshuagonzales,False,View thank husband item.,1949-06-03,2023-07-24,True
myerskimberly,perrybrenda,False,Leader dark wear best share.,2003-10-04,2022-06-16,True
gcastillo,mary22,False,Support look view say.,1939-01-17,2022-11-29,True
claudia17,jennathompson,True,Change dark major free.,1944-04-15,2023-05-21,False
john65,pleon,False,Save very less.,1964-03-18,2020-10-03,True
angelamurphy,rwalters,True,Everything source case then.,1972-08-11,2020-08-02,False
megangordon,cpeterson,True,Another civil impact data.,1967-10-16,2023-10-16,True
robin65,blewis,False,Against region figure mouth.,1977-07-29,2021-08-03,False
velezsheri,salasscott,True,My say lawyer course.,1939-04-05,2020-09-16,False
sara66,shari65,True,Manage establish here.,1993-08-08,2020-05-24,True
riveratimothy,cookshannon,True,Certainly sense stage data.,1974-10-05,2021-01-23,True
shannon09,marypatterson,True,Expect than theory Mr.,1945-04-23,2022-04-09,False
edwardhogan,colemanronald,True,Take by allow area kitchen.,1993-02-04,2021-12-09,True
raymond92,jadams,True,Day song both chance.,1987-07-06,2021-04-08,False
deannabarber,michaeljared,False,Should put student piece.,2004-03-23,2022-10-28,False
bgonzalez,joshua53,True,Act drug up choice.,1998-10-27,2022-11-25,False
cynthia19,juanlewis,False,Day small economy computer.,1991-04-01,2024-02-12,True
amber13,davidthomas,False,Next to must professional.,1996-06-13,2023-11-28,True
lauriebyrd,kathy35,False,Try author catch in friend.,1985-04-18,2022-12-02,True
bparker,sgarza,True,Mind that family top word.,1969-02-21,2023-06-07,False
daniel65,ftaylor,True,Plan benefit fast fear.,1976-10-29,2021-09-27,True
qbowers,abigail34,False,Beat cause for edge such eye.,1956-03-01,2021-03-18,True
sbrown,david86,False,Store high them treatment.,1975-02-20,2022-09-22,False
hchavez,angela47,True,Phone sure future.,1971-10-14,2023-05-14,False
mccanndestiny,allengarza,False,Rich point among.,1985-04-22,2021-05-15,False
thomaschase,mccartychristopher,False,Our leg anyone sound after.,1994-11-14,2021-03-20,False
thompsondaniel,debra63,False,Work moment both box.,1967-09-23,2020-11-09,True
ejackson,bcox,True,Present set seem but sea.,1958-07-29,2020-12-30,False
alyssaross,hcollins,False,Ready apply market.,1975-12-19,2021-09-13,False
jbates,susan13,True,Finish group beat cut after.,1980-05-25,2022-03-13,True
cookbilly,maria17,False,Who work carry generation.,1954-11-05,2022-01-11,False
sierrasanders,monique83,True,Store ability sound heavy.,1940-03-02,2020-10-16,True
donald85,claytonallison,False,Research air could even.,2001-08-21,2020-08-29,False
cpena,dennis60,True,Front from agent west.,1942-04-04,2020-10-06,True
brian70,akelly,True,Feeling clearly use painting.,1997-10-30,2023-09-17,False
tinaadams,jose36,True,Course during amount thing.,2000-04-14,2023-07-01,True
john17,williamsronald,True,True edge hand purpose water.,2003-10-11,2023-06-13,False
josemartin,marco28,True,Lay lawyer relate good right.,1986-07-22,2022-03-27,True
garrettchristina,ryan15,True,Throw near from fill.,1955-02-05,2023-12-31,False
michelle28,jennifercampbell,False,Today explain head it.,1991-10-19,2021-05-28,False
lawrence80,aliciabrown,True,Body none open.,1975-11-15,2022-10-29,False
phillipssydney,delgadojeff,False,Despite huge exist.,1950-05-15,2022-01-14,True
waltonbrandy,sheppardscott,True,Coach someone key music.,1960-06-06,2022-01-25,True
mrobertson,andrewjohnson,True,Out whole PM final per.,1986-10-06,2022-03-24,False
jeffrey54,nelsonmakayla,False,Support off finish reveal.,1959-05-15,2021-12-06,False
chrisbrown,idunn,False,Although report decade.,1953-01-13,2020-04-28,True
sandra19,woconnor,True,Rock church who chair.,1963-09-12,2020-06-08,True
michellemorgan,rdiaz,True,Agent sure spend until into.,1947-05-04,2021-08-02,False
lmartin,qbender,False,Least some rest father.,1980-09-14,2023-12-28,False
hcase,floreskatrina,False,Ten cup yourself central.,1959-12-15,2023-05-30,True
cantrelljeffrey,bryan89,False,Guy of but study much.,1984-01-15,2023-05-19,False
melissashea,brenda49,False,Sit true without ever glass.,1951-05-19,2020-10-11,False
jessicabrown,amandamartin,True,Before team value production.,1961-05-13,2022-03-10,True
nelsonnicholas,xduke,False,Way baby by us myself.,1988-06-18,2022-06-04,False
arogers,john57,True,Month fish rise great.,1969-06-02,2021-01-15,True
fischerpeter,rebeccaperry,False,Hot base wall.,1985-07-15,2023-05-01,False
sandersrachel,ygarcia,True,Western laugh idea few song.,1988-02-10,2024-01-24,False
patriciajackson,eric81,True,Door operation read writer.,1941-10-30,2022-07-20,True
reeveskatherine,kendramorgan,True,Other leg friend body.,1955-03-26,2021-12-03,False
danielknight,gmichael,False,Travel as all article.,2002-05-29,2020-09-04,False
kimberly17,shannon74,False,Ready about other person pay.,1961-01-14,2022-12-03,True
denniswilliams,warrenmatthew,False,Issue music sea grow people.,1954-03-27,2022-06-25,True
gevans,gshepherd,True,Part several third though.,1979-03-01,2022-03-06,False
josephwolf,curtiswright,True,Response red list.,1942-07-24,2023-10-14,True
jennifer78,charleswebb,True,People land ground instead.,1980-11-08,2021-08-21,True
bradley70,gabrielle11,True,Start reveal rest.,1958-01-09,2022-07-19,True
emilymoyer,hodgesdarren,True,Read from man discover.,1969-06-16,2022-10-06,True
linda06,jesseanderson,False,Else animal population.,1981-08-10,2020-11-04,True
jacobmorris,tony81,True,Wish author reflect pull.,1941-01-07,2022-10-07,True
kirbysandra,rileyrebecca,False,None agreement near.,1943-10-16,2021-12-21,False
diane85,monroejose,True,Middle day cup record.,1991-08-08,2024-02-07,True
kpadilla,jamiejackson,False,Whether result night.,2003-02-10,2022-08-13,True
brandon70,jordanjohnson,False,His outside enough view them.,1966-03-25,2020-06-27,False
amywilliams,maryfletcher,False,Civil six war small side.,1961-10-15,2023-05-26,False
earmstrong,jessicabutler,False,Shake ball make dog on.,2003-10-14,2022-04-10,False
zolsen,wharvey,False,Its truth care rule.,1962-09-22,2022-06-27,True
dabbott,elizabeth22,False,Peace walk into account.,1996-10-07,2022-08-21,False
rosenicholas,ochandler,False,Per run cup good certainly.,1955-11-19,2023-07-25,True
kellywong,jerry29,False,Need personal recent full.,1987-08-24,2024-02-15,False
lori15,phillip19,False,Class great three.,1942-01-15,2020-03-18,True
rhall,williammiller,False,Tough example arm.,1996-09-19,2021-08-16,True
jonathancarroll,powelljohn,True,Follow choose suffer sign.,1973-12-08,2022-10-31,True
cohenjames,corymendoza,True,Together above list talk.,1952-11-29,2021-04-01,True
cherylwhite,kbeck,False,Up when important.,1984-09-02,2023-06-14,True
kimberlyhaas,seanduke,True,Machine north beat.,1994-05-27,2024-04-07,True
brittneybarrett,yjohnson,False,Some focus number camera.,1966-12-11,2021-09-24,False
aaronking,cory11,True,Goal six item.,1969-01-20,2022-01-04,False
melissaperkins,calvarez,False,Adult cultural red study.,1970-11-05,2022-05-08,True
acook,ychapman,False,Mother cell hope radio have.,1958-06-02,2022-12-16,False
christiandeleon,lawrenceaaron,False,Prepare plan ask some.,1950-03-22,2021-01-19,True
erica97,charris,True,Rather live enter body for.,1973-09-15,2022-04-07,True
harveymelissa,andrecarney,True,Space state yard.,1956-03-29,2020-03-07,True
anthonymichael,phudson,False,Act eight he key likely they.,1953-09-11,2022-07-04,False
lindsay41,cookgregory,True,Difference artist star.,1988-10-22,2023-06-26,False
amyhamilton,hdavis,True,War look thus official.,1983-07-11,2023-05-07,True
stevenjackson,marie43,False,Feel five property Mr.,1981-01-20,2021-10-26,False
mccartymark,jennifermaxwell,True,West my own hospital.,1951-10-20,2023-07-02,True
katherine40,uharrington,True,Still do feel health.,1990-06-11,2021-11-03,False
andrewodonnell,daniel38,True,With group provide seat.,1994-06-07,2020-04-30,True
vrodriguez,emily72,False,Job ahead matter good.,1943-09-20,2020-11-30,True
bradyjose,natasha46,False,Man family main sound.,1972-06-25,2024-01-17,True
monica28,debrafarley,True,Behavior organization year.,1976-09-20,2021-07-07,True
maria13,kathleenrichardson,False,Beautiful recent right.,1982-12-22,2021-11-04,False
mooremaria,scottstark,False,Finish keep would today.,1967-09-17,2023-07-15,True
tatewalter,ebryant,False,Water security option write.,1938-07-29,2024-01-10,False
james63,timothycrawford,True,Next system would pattern.,1943-05-22,2021-03-19,False
fosterallen,lguzman,True,Project huge short fund.,1977-08-07,2023-12-08,True
williamsbenjamin,antoniomcintosh,True,Answer seven capital strong.,1957-06-19,2023-08-10,True
turnertiffany,rpowers,False,Task statement role spend.,1966-11-14,2023-11-03,True
lisasanders,valdezkayla,False,Room beat here listen budget.,1996-11-02,2022-07-04,False
tyler58,coxanna,False,Sort thing fund similar.,1950-05-01,2020-07-28,False
burnettbradley,hbarnett,False,Interview while item.,1940-01-23,2022-01-07,True
alex97,amanda64,True,Fine toward will ball camera.,1992-01-06,2020-10-26,False
jacobswilliam,josephleonard,True,Must blood discover.,1982-04-13,2023-10-17,False
sanchezjohnny,kristin43,False,Once name example.,2001-09-02,2024-04-06,True
stacyrivera,thomasrice,False,Heart individual meet just.,1951-07-06,2023-09-18,False
hallchad,garciasandra,True,Often American table.,1981-04-22,2022-12-07,True
pmitchell,deleonangela,True,Investment believe site with.,1961-11-07,2020-12-08,True
