Tag,Username,Blue,Description,Birthday,Joined_on,Is_profile_public
dustin85,brownfelicia,False,Through deep wide why.,1986-07-23,2023-05-19,False
waltonharry,johnsonbrooke,False,Student without suffer.,1959-09-22,2022-11-01,True
brandtkristina,frivera,True,Point which chance all join.,1962-12-23,2023-09-12,True
jacobmoss,emilyrussell,False,Describe experience very.,1989-01-16,2021-09-27,True
richard06,hweber,False,Civil rest as plan.,1991-02-18,2023-01-02,True
cameronwright,emily14,False,In true mind political.,1945-07-05,2022-07-19,True
eric67,asmith,True,Phone issue could.,2005-12-21,2022-10-30,False
frederickhansen,zjackson,False,Affect hot collection result.,1956-05-11,2022-09-11,False
lkerr,lstewart,True,Heavy health bag between.,1965-01-11,2021-01-14,True
sortiz,julielowe,False,Reveal middle set include.,1977-04-02,2022-11-25,True
ojohnson,richardpage,False,Over piece human together.,1971-08-09,2022-04-12,True
nelsonbrady,imcdaniel,False,Ok top born fast.,1992-02-12,2021-11-24,False
stevenhunter,scott66,False,Avoid could yes fact happen.,1953-03-22,2022-08-10,False
christine19,wilsonjoseph,True,Material worry share must.,2001-08-28,2023-04-10,True
tara06,stewartmichael,False,Others these chair trip wish.,1999-02-24,2022-01-28,True
perrybrenda,charles57,True,Cold collection central.,1957-01-17,2020-11-14,True
johnsonjoseph,ramirezjonathan,False,Body require your by between.,1955-07-14,2023-03-22,False
zthompson,jonesdavid,True,Respond ask month research.,2003-10-20,2023-07-22,True
devonmartinez,jamesjenkins,False,Color sense thank.,1971-08-04,2022-08-24,True
knightleslie,smithsteven,True,Send parent knowledge.,1954-12-29,2021-03-19,False
kleinlisa,alyssa63,False,Weight record total myself.,1953-06-02,2023-09-09,True
holly03,xhuffman,True,Stock loss resource office.,1965-08-17,2021-05-05,True
paulasmith,patrick82,True,Yard girl finish left.,1959-04-05,2020-06-12,False
hamiltonbrooke,xhess,False,May government point else.,1955-07-15,2020-08-28,False
cooperroberto,colinlewis,False,Fund care father message.,1950-01-30,2023-06-01,False
oliverjulie,jcampbell,True,See phone seven real exist.,1995-08-13,2020-09-27,True
jessicaweber,benjamin00,False,Return reflect think vote.,1964-05-24,2023-02-27,True
bwilson,mmitchell,True,Medical base development.,1986-12-29,2023-07-18,False
dweber,jamiecastillo,False,Sit not tell.,1963-11-21,2021-10-11,True
curtis56,pcarroll,True,Director green imagine play.,1990-01-17,2020-07-04,False
brianrodriguez,brownlorraine,False,When study money computer.,1938-06-15,2021-04-22,True
cgonzalez,mcclurejose,True,Back necessary community.,1982-09-01,2021-07-26,True
townsenderin,morrislinda,True,Enough goal choose hour.,1997-05-10,2024-02-18,False
xnunez,diazbarbara,True,Nearly us family story.,1997-03-20,2020-05-04,True
jessica01,rsmith,False,Former now spend.,1948-03-15,2023-06-29,True
vbaker,jermaine77,False,North glass particularly.,1941-08-04,2021-12-11,False
mary03,michael71,True,Kind toward east heart sign.,1970-08-28,2024-03-12,False
oferguson,alexandersweeney,False,Around develop return.,2003-02-24,2022-10-12,False
nortontracy,matthewmartin,True,Factor cell road point.,1949-02-12,2022-03-05,True
millercaleb,cindysteele,False,Last wrong as present fact.,1995-10-15,2021-12-06,True
davidpatterson,sphillips,True,Wrong do ahead seat.,1946-12-12,2022-10-24,True
harrisregina,iscott,False,Help buy surface half mind.,1986-07-04,2021-07-01,False
christine25,jacob14,False,Full those like.,1990-09-05,2023-04-08,True
gutierrezamy,zachary33,False,Wife new than almost.,1999-04-12,2021-02-18,True
williamjohnson,maylisa,False,Receive address the response.,1993-11-22,2021-01-22,True
andresmontgomery,shannon33,True,Wrong control happen through.,1956-06-17,2022-01-18,True
michellesmith,melissasmith,True,Test evening skill.,1993-09-06,2021-09-06,True
barbara57,amber47,True,Blue could ok charge while.,1963-11-13,2021-06-27,False
changmaureen,rturner,True,Peace change receive son.,1944-06-17,2023-01-08,True
kathleen84,carrie63,True,Ever state air on.,1960-03-28,2023-06-13,False
alexander58,baileybrittany,False,Believe where analysis born.,1952-02-19,2021-06-17,False
harristhomas,daniellecompton,True,Scene write heavy sign.,1996-01-20,2020-04-08,False
careyalexandra,alyssacastillo,True,Because product beyond.,1987-11-20,2023-10-20,True
ashleyhooper,jasonshaw,False,Cause never foreign owner.,2004-10-21,2020-10-23,False
ericabarton,dominguezalicia,True,Suffer structure station.,1978-09-01,2021-05-04,True
xmercer,anichols,True,Seat name great size expect.,1981-01-12,2023-10-27,False
johnsonlindsay,harrisonandrea,False,Pressure school action.,1941-08-24,2021-10-30,False
johncoffey,darrellholland,False,Election study southern only.,1988-04-07,2021-07-08,False
tinasimmons,lzamora,False,Population behind step word.,1950-11-28,2023-02-22,False
tracysmith,nicoleross,True,Check necessary second two.,1944-04-08,2020-07-09,True
reedbrian,oneillsandy,False,Read home house beat.,1992-12-19,2021-12-26,True
taylor21,ihall,False,Mrs lot open.,1967-05-25,2022-10-18,False
jessica20,conniemejia,False,Citizen attorney likely.,1969-12-05,2022-05-29,False
garyyates,rubiojeffrey,True,Wait choose charge north.,1961-03-17,2022-10-16,False
riversbonnie,jilliansmith,False,Discover drug Democrat.,1952-09-14,2024-01-13,True
dyerryan,danielle24,True,Reach but thank brother.,1951-12-12,2020-08-12,False
scott84,jordan63,False,Three tough miss fine reason.,1981-02-19,2021-04-29,False
christopher63,sjackson,True,Drop college food now.,1975-10-14,2021-09-07,True
parklaura,westleslie,True,Mean bit face involve peace.,1960-10-03,2020-01-15,False
davidwang,fbarton,False,Building product many left.,1991-01-20,2022-03-07,True
birdseth,ghall,True,Middle in tree material.,1965-04-15,2022-05-02,False
uherrera,nguyenryan,False,Change thing join ago.,1979-07-27,2020-12-14,True
stephanieburke,mlarsen,True,Which bag position.,1979-05-27,2022-10-28,True
ufreeman,ericellison,False,Strong too feeling him order.,1986-10-15,2020-03-13,False
owenschristine,patriciamiranda,False,Market course consider help.,1974-11-15,2023-07-15,True
ethan42,cooperkenneth,True,Allow partner politics.,1956-01-22,2020-09-19,False
mccoyzachary,timothy48,False,Including somebody door bad.,1994-06-13,2020-09-11,True
twright,patrickhuang,False,Effect tree prove bed.,1974-06-26,2020-09-07,True
gburton,lawrencemary,False,Save hair summer during bar.,1945-01-20,2022-05-07,False
pstout,yolson,False,Account anyone will large.,1978-06-03,2022-03-11,True
ntravis,wrightnicole,True,Drive employee its whose.,1956-07-29,2021-10-29,True
cowanbrittany,lisamorgan,True,Similar the trade center sea.,1976-02-04,2024-03-26,True
ocarrillo,jonathanperez,False,Help reason ask commercial.,2000-03-20,2020-11-24,False
penningtonscott,mark53,True,Sort TV so top he.,1965-08-08,2020-02-20,True
morrisscott,bnichols,True,Political upon class test.,1984-03-15,2021-04-27,True
zmayer,russellmackenzie,True,Serious itself culture learn.,1987-04-27,2022-11-12,False
srocha,kevin66,False,Truth voice fast development.,1978-05-18,2023-09-26,True
bradshawjonathan,scotttimothy,False,Ability rise ever.,1981-11-11,2022-03-13,False
sophia27,kylemacdonald,False,Culture police fish list.,1942-07-20,2022-02-14,False
cherylalexander,johnsoncalvin,False,Ready page sure.,1955-07-12,2021-06-24,False
shelbyhutchinson,nmccarthy,True,Per with spring.,1946-05-21,2022-06-20,False
vchambers,james11,False,Because eat should.,1982-06-29,2022-08-09,False
xallen,nuneztara,True,Space experience best step.,1962-07-09,2020-03-27,True
hallanna,woodamy,True,Second anything guy computer.,1939-09-18,2020-05-03,True
marisa62,kylekaiser,False,Second pull watch next.,1967-07-15,2022-12-02,True
zcruz,andrew84,True,Like that behind including.,1965-08-02,2020-08-13,False
onguyen,vwright,True,Offer three key.,2005-05-25,2022-07-03,False
uoliver,williamsdavid,False,Sense trip report discover.,1978-11-08,2021-12-17,False
ariggs,denisepatel,True,Necessary southern pass.,1944-08-11,2023-11-23,False
xrivera,anthony01,True,Start one a.,1971-04-23,2021-07-31,False
adamsaudrey,aali,False,Building child teacher.,1957-08-03,2022-03-04,False
holmeschase,anthonyking,False,Baby more popular military.,1968-08-28,2022-09-18,False
cvilla,kenneth46,True,Other seek your also.,1990-06-02,2020-04-24,True
traceyschultz,christopher78,True,Miss challenge itself.,1939-10-21,2022-02-26,True
michelle30,srodriguez,False,Fish baby every prove true.,1977-08-12,2022-01-07,True
glenn05,apeters,False,Oil husband capital herself.,1960-01-06,2023-10-10,False
youngalexander,hmartin,False,Whole hold property evidence.,1975-02-25,2022-09-10,True
macdonaldmichael,maria73,True,Year culture also woman.,1983-02-07,2022-11-16,True
mitchellcowan,rodrigueztimothy,True,Coach also work full reason.,1994-01-11,2020-02-02,False
alexandrawhite,riosmelissa,False,Resource age guy.,2005-12-13,2023-10-18,False
christopher78,jenniferpierce,False,Seek century need think.,1952-12-18,2020-03-13,True
bgoodman,westjennifer,False,Use keep member.,1995-12-23,2023-10-20,False
rsimon,laura58,True,Decision among in family.,1968-08-22,2022-04-20,True
ahoward,itravis,False,Among they of speech.,1968-05-06,2023-01-31,True
christopherlane,qhogan,False,Two election view table send.,1999-12-05,2022-05-22,False
dpatel,rball,True,Area member production page.,1945-06-25,2022-05-22,False
gregory61,joseph24,False,Away pretty usually civil.,1974-10-02,2020-11-30,True
fhernandez,achung,False,Personal many effect third.,1990-07-17,2020-07-06,True
jared50,fschmidt,False,Party base wife suddenly to.,1978-04-01,2023-09-11,False
washingtonnoah,bgonzalez,False,Find research buy about.,1996-10-15,2022-03-08,True
carol29,gonzalezpatricia,False,Past woman dream court make.,1968-03-14,2020-01-09,False
clarkmichael,john38,True,Per art try manager.,1987-03-10,2021-08-14,True
dspencer,bartongabrielle,True,Operation all skill history.,1946-12-10,2022-06-10,True
reevesjonathan,kentkevin,False,Table week after myself may.,2003-04-06,2022-05-17,True
yperry,jeffrey96,False,American example gas quality.,1947-08-20,2022-08-18,False
lukevaughn,spatel,False,Range central young sort old.,1962-04-29,2022-01-07,True
tammyschroeder,lopezernest,False,Us rock PM.,1987-11-09,2023-12-15,False
terryamy,garciaangela,False,Wait evidence argue future.,1966-08-29,2021-10-02,True
zfigueroa,lstafford,False,Art without high trial art.,1992-06-06,2020-04-13,True
russellallen,alexandervincent,True,Husband option billion trip.,2001-02-20,2022-09-19,False
lisaguerrero,dmorgan,False,First third look.,1989-05-19,2021-04-15,False
xjones,ronaldhunt,True,Quality happy his worker.,1995-09-10,2021-03-16,False
ununez,susantorres,True,Few happen such everybody.,1980-11-02,2021-03-11,False
fparker,gutierrezchristopher,False,Test tend character senior.,1942-01-28,2022-10-28,True
cruzjohn,joseph75,True,Manager sister arm.,1975-06-15,2024-01-10,True
ambergibson,melanieavila,False,Adult leave sit machine.,1940-09-28,2023-08-25,False
ashleyhouse,meghanbailey,True,Remain computer throw.,1953-01-10,2022-09-15,False
wallaceadam,daltontaylor,True,She test song play.,1964-10-30,2021-10-06,False
jakegomez,tayloramanda,False,Care drive event find police.,1980-07-19,2023-07-30,False
nramos,hansenmonica,True,Soldier even road which.,1941-11-07,2023-01-18,True
amywade,henrydeanna,False,Perhaps able specific.,1961-03-20,2020-12-04,True
frank90,grayalex,True,Factor clear second feeling.,1988-08-09,2023-01-12,False
christopher08,michaelodonnell,True,Black business of choose.,1994-11-11,2022-05-06,False
emma08,llewis,True,Tax policy so center.,2003-08-28,2022-01-18,True
kellybrian,jessicagriffin,False,Five left response reason.,1995-04-14,2023-02-04,True
denise26,ywalker,False,Out last stage.,1972-12-06,2022-06-11,True
tjuarez,debbiefreeman,False,Seem head else music try.,1988-05-26,2022-06-13,True
parroyo,rsimon,False,Clearly traditional region.,1944-09-10,2020-01-03,True
figueroacharles,laura68,False,Inside response study view.,1972-11-16,2021-08-27,True
angela53,maria64,True,Finally view cover product.,1961-10-27,2021-11-14,True
ashleyjohnson,jaimejackson,False,Grow policy however.,1969-07-30,2023-10-01,False
trevorbennett,jeanette34,True,Thought left firm wish.,1992-07-19,2020-02-28,True
katherinehubbard,larry05,False,Generation head human.,1969-12-07,2020-10-02,False
ewright,pjohnson,True,Couple allow too.,1981-10-07,2020-10-26,False
frankmiller,mcarpenter,True,After despite after industry.,1986-05-01,2020-03-17,True
feliciareyes,gsawyer,True,Avoid near PM study.,1977-09-07,2022-06-30,False
jordangarrett,xwerner,False,Marriage future address his.,1960-03-30,2021-01-03,True
jessicamathis,matthewtorres,False,Both choice lay organization.,1999-03-24,2023-01-24,True
sandra70,roy32,False,Prove left night always.,1974-01-08,2020-12-15,False
jenny46,swansonjohn,True,System husband four that.,1993-04-01,2023-01-27,False
joshuaross,wtaylor,True,Federal investment threat.,1958-01-02,2024-04-13,False
brittneywhite,matthewstanley,True,Be animal now dark my many.,1995-05-27,2024-03-10,False
rioslori,april25,True,Dog defense finish walk.,1973-08-28,2022-09-23,False
mark67,dallen,True,Save surface change.,1984-10-16,2021-02-07,True
ann72,johnsonamanda,True,Need I physical shake.,1943-06-18,2022-07-17,False
frogers,nicholasashley,False,Report Mrs mouth today.,1962-02-21,2022-02-01,True
millerpaige,boydanita,False,Use also then through grow.,1993-03-08,2023-01-19,True
brucejohn,jessica03,False,Or hold explain race cut.,1986-03-06,2022-12-16,False
wilsonchristopher,cmartinez,True,Food fish Democrat.,1945-10-07,2023-06-22,False
wclark,barryjoseph,False,Fine away technology dog.,1952-03-04,2021-03-10,False
tracy47,barbara26,True,Sister page if live.,1992-10-22,2023-11-05,False
bakerjoyce,xgarcia,True,Grow miss property however.,1996-08-14,2021-08-25,False
mariastokes,uturner,True,Far fish ground read.,1969-12-02,2024-02-18,True
jeffrey93,brandonkramer,False,Generation yet however.,1981-06-25,2020-01-04,True
zacharysmith,rosswilliam,True,Great walk when go.,2001-06-18,2020-08-06,True
dennis58,zachary95,True,Building day tend old once.,1967-12-06,2022-01-19,False
veronicahoffman,ogonzalez,False,Expect walk national tree.,2005-04-29,2022-11-24,True
lisaday,yrodriguez,False,Defense itself I color.,1999-06-21,2021-07-15,True
mark09,russojustin,True,Body growth fund accept soon.,1964-11-13,2021-05-05,False
lori87,darrell12,False,Fill must history.,1981-01-09,2020-12-09,False
rclarke,weeksjoel,False,Street sea each whatever.,1990-01-25,2021-06-15,True
gina04,potterjohn,False,Road poor remain no.,1976-08-02,2021-07-19,False
dandrade,jennifertran,False,Shake start paper find.,1955-01-02,2021-03-06,True
blackbrian,chanamanda,False,From bank risk ask same.,1945-09-08,2021-10-07,True
imacias,sdouglas,False,From maintain politics name.,1942-02-27,2021-04-03,True
udavis,karen05,True,Best this wife vote.,1951-03-26,2021-03-27,False
jennifer36,josephscott,False,National four clear set sit.,1984-12-11,2022-08-01,False
millerallen,myersbilly,True,Other direction region.,1989-01-27,2024-01-08,False
broy,sarahenderson,True,If off enough speak.,2002-01-02,2023-02-18,True
danmorrison,smithcatherine,True,Yes grow success necessary.,1953-07-21,2023-09-20,False
victoria34,stephenwhite,False,Light cup school college.,1990-03-31,2023-04-28,True
jenniferduncan,youngchristopher,False,Coach process level side.,1986-06-11,2020-04-16,False
vsolis,simsthomas,True,Yes or turn at style others.,1994-10-26,2023-10-05,False
andrew74,salinaspamela,True,Bill control take occur loss.,1975-04-14,2022-06-08,True
wayne41,serranostephanie,False,Past relate three east.,1942-07-03,2023-12-20,True
stevenschristopher,thompsonjason,False,Forward it central as.,1964-03-21,2021-11-07,False
murraystacy,zfarley,False,Radio kitchen part.,1960-08-23,2022-03-07,True
michellehurley,carolyn24,False,May north first factor.,1963-08-16,2020-04-12,True
morgan89,obrienkatie,True,Check leave mouth name.,2000-05-31,2024-01-28,True
sheenasmith,jamesjonathon,False,Bed culture late view.,1975-06-08,2021-10-19,True
christopherwilson,jacksondrew,True,History enough morning form.,2002-05-23,2023-01-10,False
christophercastro,wuvictoria,True,Hotel where environment.,1948-01-11,2020-05-13,True
joseph94,james19,True,Drop continue include though.,1960-06-04,2021-04-28,True
kenneth19,kclements,False,Pressure lot camera receive.,1987-06-17,2023-04-12,False
hatfieldmonica,woliver,True,Rate perform home develop.,1965-06-09,2024-01-05,True
millerbenjamin,wolfaustin,False,Ready lay name figure to.,1996-06-28,2020-04-18,False
julievazquez,jeffrey75,False,Teacher already whether and.,1994-07-06,2022-04-12,False
xcarlson,qcox,False,Wall notice explain must who.,1983-04-03,2021-11-29,False
christinegutierrez,tiffanyfranco,False,Catch serve increase onto.,1999-07-22,2024-03-07,True
marygalloway,bushdean,True,Leader her practice.,1972-07-27,2020-10-26,True
frencheric,alvaradoshelby,True,These run its carry office.,1941-05-03,2020-11-13,True
gonzalesandrew,garciadennis,True,Speech find brother only.,1968-05-29,2022-03-09,True
faith13,peggyhernandez,False,Opportunity best bank style.,1972-08-03,2022-05-14,False
jenna54,haileygraham,False,Who cell true if section red.,2004-06-10,2023-11-03,False
brewerjonathan,rachelsmith,True,Best season window that.,1970-02-08,2022-03-25,True
michaelallen,brittanyriley,True,Senior front eight various.,1977-06-29,2023-08-26,True
colemanjeremy,robertsjustin,True,Pass not clear.,1982-08-01,2023-09-08,False
kristincollins,karen36,False,Easy maybe effort maintain.,1983-03-28,2021-03-22,True
joneskenneth,marksalazar,False,Ever action thus talk.,1971-06-14,2023-03-01,False
uobrien,michelle92,False,Fly tree edge water.,1990-09-15,2020-09-26,False
anthonyvega,rguerra,False,Here against law.,1975-04-11,2022-11-08,True
andersontabitha,melissabarton,False,Glass tonight record.,1969-08-21,2024-04-05,False
brett84,gomezbradley,True,Common same water.,1958-02-10,2024-02-03,False
anthony33,griffinmark,True,Address offer thank with.,1951-01-02,2023-03-24,True
proberts,emercer,False,Court film tonight local.,1981-04-05,2023-12-13,False
david78,xvazquez,True,Exactly wide nearly in.,1949-11-29,2023-12-15,False
mccartywillie,lisaweaver,True,Heavy behind himself.,1990-05-04,2023-09-12,True
hopkinsrenee,gharris,True,Heavy sport threat space six.,1979-01-30,2022-10-26,False
ocastillo,williamalvarez,True,Word marriage bag.,1961-08-24,2024-01-14,True
dalepope,meghanroberts,True,Talk laugh the garden.,1954-05-08,2020-05-20,True
brooksmitchell,douglashannah,False,Sport care enjoy million.,1997-03-14,2020-01-03,False
kyle38,fergusonevelyn,True,Message north quickly they.,1990-10-09,2022-04-13,True
katherine54,victoriagomez,False,Ahead pull ever base.,1968-02-10,2021-03-08,True
candice88,baileybrad,False,General key dog small near.,1975-03-01,2023-09-02,True
sdurham,bradmorris,True,Easy history control guy.,1957-09-25,2021-09-16,True
ryanjohnson,rjohnson,False,Rest reach it oil important.,1998-02-20,2022-08-24,True
kyle69,tsmith,True,Build news morning while.,1949-04-19,2021-03-12,True
salascaitlin,kknox,True,Wait short executive at.,1956-05-25,2023-07-12,False
steven60,fieldsjennifer,False,Foot form able commercial.,1952-02-13,2023-05-11,True
ochoajustin,thenson,False,Say article and eye.,1974-04-08,2021-05-18,False
umyers,aaronvaughn,False,Outside role bank mean place.,1958-05-09,2020-01-07,True
brittany30,cynthiamiller,True,Change edge cause.,1975-05-22,2021-10-17,True
ugross,zfrancis,False,Visit baby move job expect.,1948-09-08,2021-05-20,False
jacobmcdaniel,wileyjennifer,True,Personal clear pattern.,1961-12-30,2020-03-05,False
rodriguezjasmine,wyattnathan,False,Door interesting over great.,1963-01-05,2022-01-27,False
rwhitney,lopezpaul,False,Piece tend life form.,1974-06-22,2021-03-22,False
gonzaleskrystal,mary97,True,Ask team others.,1985-01-25,2020-05-01,True
brianwolf,vernon27,False,Always fear the oil.,1990-12-14,2023-03-14,True
xpatrick,jeffrey01,False,Know level stage.,1949-03-01,2022-12-28,False
susan41,robertbarber,True,Plant put serious return.,2003-07-12,2022-07-17,True
langmark,diane57,False,Risk prove free.,1992-01-06,2020-04-09,True
jonesmichael,csanchez,False,Report run its artist.,1970-02-09,2020-11-30,False
andrea86,wilsonfrancisco,True,Without spend level.,1995-07-26,2020-12-27,True
haleywolfe,smithdonna,False,Wonder top beautiful throw.,1971-12-01,2024-04-01,True
joshuajones,orodriguez,True,Minute yourself still admit.,1976-10-30,2023-03-07,False
robert18,jenniferlawrence,False,Something statement impact.,1947-04-27,2022-06-27,False
owendavid,mitchelldavid,True,Stock success near radio.,1980-11-18,2021-09-15,False
julie65,michaelbrooks,True,Choose break relate very.,1999-03-08,2020-12-31,True
kelly93,smithmatthew,True,Even watch practice.,1944-02-05,2023-03-05,False
uhoffman,russellclayton,True,Remain production some.,1950-02-18,2022-01-24,False
timothy70,michelle30,True,Close weight do play.,1965-02-22,2020-01-12,False
karen89,hillcaleb,False,Color source east trial.,1947-01-27,2020-07-25,False
robertrogers,rgriffin,False,Effort stop commercial.,1960-11-16,2020-08-07,False
sawyermichael,hermanaustin,True,Must cup need none.,1967-06-28,2023-11-04,True
eanderson,boydelaine,True,War deep name week.,1948-08-01,2020-09-19,True
daleshaw,escobarrichard,True,Control stock identify prove.,1989-10-29,2022-02-09,True
valeriejones,westtina,True,Past thus citizen five paper.,1953-02-04,2024-03-02,True
kathypeterson,afisher,False,Social my threat quality.,1945-12-06,2020-06-11,True
owenashley,dwilliams,True,On born lawyer.,1966-05-09,2021-07-04,True
daniel53,charlottestout,False,Serve else lay.,1992-11-23,2020-01-22,True
mark27,jjones,True,Run contain main trouble.,1977-07-30,2022-01-03,False
brittanylee,smithrachel,True,Still near evidence every.,1985-12-27,2021-10-11,False
danieljackson,richardgould,False,Who although against claim.,1991-04-21,2023-05-21,True
tperkins,clarkmichael,True,Capital kid meeting learn.,1996-05-21,2020-10-02,True
hmartin,jcoleman,True,Kid policy return.,1958-08-03,2023-01-11,True
joshua32,mark83,False,Every authority dream head.,1968-11-03,2020-11-19,False
hannah13,brianramos,True,Allow senior garden.,1999-12-06,2022-11-28,False
mariahuynh,kellyelizabeth,True,Challenge now decide my.,2003-12-09,2023-07-03,True
david91,paula51,True,Nice them true.,2005-01-28,2020-03-15,False
jonesmarissa,james92,True,Box sea fund capital less.,1944-11-27,2021-01-24,True
lisapadilla,daviddalton,False,For mind a reduce.,1943-05-29,2020-11-04,False
okelly,crandall,True,Foot from couple receive.,1956-06-08,2022-07-28,True
annette95,jwalker,True,Memory class during.,1971-04-26,2023-11-13,False
heberttammy,hartmanleslie,True,Dog price garden.,1976-11-01,2021-08-13,True
charles84,james94,True,History really become base.,1971-07-04,2022-02-18,False
john81,rleonard,False,Within list itself law.,1975-09-05,2022-02-01,True
martinezapril,seangilbert,True,Continue at go crime.,1951-01-31,2022-03-14,True
yateserin,garciajennifer,False,Leave until prevent foreign.,1944-05-26,2021-08-02,True
reynoldsjoshua,pamela08,True,Effort sit couple main ago.,1954-06-07,2020-03-22,True
brendaabbott,dmedina,False,Kid company team.,1989-03-20,2022-05-13,False
phillipseric,rachel52,False,Perhaps some above.,1999-10-01,2022-07-12,True
crystal50,bsherman,False,Road buy they window.,1999-04-29,2020-05-31,False
porternicole,miranda90,False,Why so benefit hour another.,1962-12-21,2022-01-23,True
patrick37,lbishop,False,Two worker question.,1952-06-14,2024-01-26,True
holmessandra,kmoore,True,Nature future art not reach.,1971-05-06,2020-01-01,True
zhurst,greenanthony,False,Price alone recognize.,1969-01-08,2020-06-18,False
melissajohnson,wphelps,False,For character course.,1999-05-25,2021-12-16,False
zkeith,qharrell,False,Move often move course.,1992-03-18,2020-04-22,True
aimee42,nmitchell,True,Do within page popular box.,1973-07-22,2022-12-20,True
jeremy52,poolekiara,True,Huge occur guess environment.,1972-03-25,2020-04-29,True
katherine64,robin33,True,Population without wind son.,1994-05-24,2022-06-02,True
silvajodi,reyesmark,False,White any body phone common.,1946-03-08,2022-11-30,True
millerpamela,sherripeterson,True,Already stand including.,1988-09-22,2023-04-26,True
april60,probinson,False,Base perhaps ever lay.,1982-07-06,2024-04-04,True
erin33,mjohnson,False,Trip value few evening.,2000-12-22,2021-01-20,True
mark73,rebeccamartinez,False,Either cost stay daughter.,1985-06-05,2024-01-13,False
lopeztina,farleyrebecca,False,Red out grow fear store film.,1998-11-11,2021-05-26,False
randallmorales,bob26,True,Main easy must local.,1972-07-30,2022-11-04,True
hblake,kmorgan,False,Free top newspaper marriage.,1995-02-27,2021-06-03,False
joshuajohnson,rachelhoffman,False,Often up shoulder different.,2005-03-19,2021-04-13,False
estokes,chendrix,False,These while end sure.,1952-02-24,2020-10-02,False
crystalwilliams,sarah56,True,Age low bar adult education.,1982-12-07,2024-01-10,False
awilson,pmoss,False,Wonder cost measure.,1989-06-17,2023-07-02,False
joshua53,bmoore,True,Idea not moment.,1941-06-22,2021-11-04,False
scott96,jennifer01,False,Foreign stock someone miss.,1954-08-14,2020-11-05,False
georgeking,victoriaaustin,True,Style value direction line.,2000-05-30,2023-10-12,False
shawdevon,rachelibarra,False,Approach turn each fund.,1978-12-05,2022-05-12,False
sarah31,xkim,True,Speak not though personal.,1963-09-13,2022-03-04,True
lynn80,stephanie11,False,Live culture action really.,1991-01-16,2021-10-01,True
mendozaroberto,teresabenson,False,We we economic nor door.,1950-12-12,2020-02-27,False
michaelhenry,rweber,True,Leader home break southern.,2005-04-25,2023-04-16,False
andrea31,ffloyd,False,Bad feel get well.,1993-09-19,2021-01-17,True
martinsantos,chavezdanielle,False,Able use support.,1959-07-31,2021-09-06,True
lanecindy,kristina73,True,Toward second market.,1992-05-26,2020-04-24,True
keithterrell,qstewart,False,Every loss about.,1941-10-15,2023-01-19,True
