Tag,Username,Blue,Description,Birthday,Joined_on,Is_profile_public
palmerjustin,ambernavarro,True,Six month central commercial.,1972-09-25,2021-08-21,True
smithtracy,ashleywebb,False,Activity turn board.,1998-05-28,2021-06-02,True
gdavis,greennicholas,False,Popular member rate.,1983-12-08,2023-06-15,False
howardbrandon,jessica76,False,Want trial wrong of risk as.,2004-09-09,2020-05-23,False
clinton77,jason84,False,Whole able treat myself year.,1955-04-27,2021-10-05,False
michaelsilva,caleb11,False,Summer local generation.,1979-05-16,2020-01-13,False
tammyferrell,jacksoneric,True,Food see type point.,1952-01-31,2023-07-20,True
joe42,lhuff,False,Safe newspaper benefit top.,1939-12-01,2021-12-03,True
lindapaul,lhorton,True,Million sea which show.,1969-12-03,2022-07-25,False
ashleycooper,morgan51,True,Car much adult art.,1967-02-03,2023-02-01,False
garciacameron,freemanmary,True,Single defense west play.,1949-06-05,2021-11-14,True
joshuaorozco,gcarrillo,False,Deal coach strategy deep.,1987-08-16,2022-10-05,True
hopkinssara,scottcarrie,False,Word world agent since dark.,1982-01-19,2020-10-04,True
lrios,shaneguerrero,True,Both price show raise.,2004-09-03,2023-02-05,True
cochrankaren,vmunoz,False,Away bed yes.,2001-05-09,2020-06-15,True
upowell,kgarcia,False,Rise glass choose.,1985-03-11,2022-01-10,False
kevin15,heidiwilliams,False,Son open but prevent cover.,1967-06-06,2020-06-19,True
kari35,holderjames,False,Heart seem keep task result.,1975-05-25,2021-12-31,False
jasongraham,bennettheather,True,Son might design anything.,1987-01-03,2022-05-22,False
jellis,qturner,True,Meeting he consider.,1955-08-06,2021-04-14,True
alexandria91,martinezmichelle,False,Determine coach where.,1939-05-12,2020-12-06,True
ggill,tamaraho,False,Half nation rate.,1998-06-27,2022-09-30,False
vking,kimberly29,False,Big pretty tax dream.,1983-04-30,2024-03-26,False
pbates,stevenrollins,True,Ever well pretty training.,1960-03-06,2023-11-05,False
eschwartz,brian56,True,Mouth store dream film.,1939-09-26,2022-06-20,True
ismith,victoria31,False,Left red school share speech.,1987-04-22,2021-09-15,False
underwoodstephanie,troy00,False,Fire decide race get compare.,2002-12-31,2020-07-06,False
nicolas12,christinealvarez,True,Rule voice side tree kid.,1973-10-31,2022-09-10,True
munozandrew,xlin,True,Other sense choice establish.,2006-04-04,2020-04-16,False
kyle51,alyssa99,True,Yard value fall.,1993-05-21,2023-02-04,True
xmills,jillzavala,True,Put lot provide me boy.,1968-01-11,2022-01-04,False
wayneklein,kimdavid,True,Food less old film.,1968-01-23,2023-09-01,True
bryanjohnson,fdavis,False,Save rock other evidence.,1947-01-08,2021-10-25,False
rick15,elizabethmason,True,Television art commercial.,2002-09-28,2022-03-08,True
ginahernandez,lholland,True,She them trouble if.,1966-06-07,2021-05-09,True
kkent,juan41,True,Happen where lay camera.,1965-05-12,2022-09-05,False
uparker,wjensen,True,Interesting agency pay value.,1946-06-23,2024-03-24,True
sfrazier,mshaw,True,Trip second store book two.,2001-10-15,2020-05-02,False
reginald01,franklinjonathan,False,So voice man military.,1949-08-30,2022-09-30,False
kimberly67,fbrown,False,Every realize face.,1970-07-06,2020-12-13,False
jnorris,johnsondouglas,True,Floor way experience left.,1990-10-09,2021-05-04,True
bortega,vhenry,False,Money war finally election.,2001-07-28,2021-12-31,True
peter86,spencermichael,True,Accept they practice join.,1949-06-06,2023-04-21,True
kblake,rodriguezerin,True,Charge system much determine.,1997-07-29,2020-10-16,True
jon50,ybauer,False,Space ball whom rather.,1976-11-10,2024-04-16,True
bobby05,melissahawkins,True,Over open dinner official.,1941-03-27,2021-11-12,False
lewisandrew,lward,True,Myself floor business.,1953-05-22,2021-12-23,False
vanessasloan,hdaniels,False,Perform television analysis.,1975-08-31,2020-09-17,True
wfreeman,leedenise,True,None three always hard play.,2001-06-14,2021-09-28,False
michaelharrison,ichandler,True,Management east myself yes.,1997-12-20,2022-09-28,True
esalazar,vclark,False,I dinner decade let sound.,1992-10-21,2021-04-26,True
jesuspetersen,fmartin,False,President government play.,1958-03-08,2020-08-06,False
xhall,angelakelly,True,Threat per room alone idea.,1952-05-24,2021-06-22,False
vwatkins,tlewis,True,Rich phone leg education.,1955-03-04,2022-12-20,True
edward28,scottsmith,False,Check author owner eat.,2005-05-14,2020-05-13,True
charles14,halejeffrey,True,City business us fact soon.,1949-01-08,2023-11-14,True
cooperbeverly,angelanguyen,True,Project easy so like sport.,1947-05-22,2022-03-29,False
ericawatson,sharondavis,False,Together worker short.,1971-05-03,2023-03-30,False
deckeralejandra,brownjames,True,According could quickly.,1994-10-13,2021-07-19,True
frederickvelez,jacobdavis,True,Require fall product.,1981-09-24,2023-03-16,False
shawharold,harrytucker,False,Medical view thus guess base.,1984-08-22,2020-10-16,True
ashleybailey,lopezmadison,True,Consider where a help arm.,1965-05-29,2020-10-21,False
philip94,georgesalazar,False,Key impact degree bag feel.,1974-10-27,2022-11-29,True
robertmartinez,shannongreen,False,Be whole fight allow media.,1971-11-15,2023-07-31,True
ryan45,christina92,False,Win head nation tree eye.,1974-10-07,2021-11-15,False
charles90,brittanyclark,False,Could bill source Mrs.,1956-05-10,2020-11-20,True
shaundiaz,woliver,False,Firm thing very play.,1967-04-02,2022-08-24,False
phillipssherry,stephanie23,True,Police region radio history.,1956-04-15,2023-12-31,True
quinndawn,ashleyowens,False,Peace until certain letter.,1982-09-06,2023-11-06,True
yzuniga,fbarnes,True,Dream hear data cover.,1976-02-09,2024-01-04,True
pattersonamanda,andersonbryan,True,Apply article important mean.,1965-11-11,2022-12-01,False
xchavez,jasonhenson,False,Son she school.,1941-08-22,2021-08-03,True
harrischad,christinemiller,False,Blue individual week answer.,1973-04-21,2022-03-23,True
wreynolds,sydneytorres,True,Pull even black.,1985-12-16,2023-03-05,False
alvareztimothy,dmedina,False,Several set detail.,1983-02-20,2020-03-12,True
carrie52,krodriguez,False,Piece apply continue Mr.,1960-07-15,2022-02-03,False
erikawilliams,jodymiller,True,Full play learn task.,1941-12-29,2022-10-07,False
angelatorres,joelmcfarland,True,Loss eye chance pick.,1952-09-05,2022-12-25,False
jenniferperry,zberry,False,Bar arm other our.,1974-04-06,2021-07-15,True
emartin,gordonfernando,False,Continue down likely music.,1946-11-22,2020-06-15,False
masseyheather,kdouglas,True,Stop southern onto.,1942-03-22,2023-08-25,True
thomasdanny,mendozakaren,False,Name large assume.,1951-09-05,2020-09-09,True
lwhitaker,kevin21,False,Often treat traditional a TV.,1965-07-01,2020-11-11,False
annapatterson,elizabethharris,False,Help paper technology.,1957-12-27,2023-02-22,True
nancybrown,kelly62,True,Out growth media perform.,1995-02-01,2021-07-07,False
lisa99,craigmaria,False,Country lead thing own.,1988-04-11,2021-10-02,False
andersonnicholas,erinmiller,False,We name father.,1969-03-05,2023-05-18,True
nicoleking,manuel29,False,Push fast away step million.,1951-05-18,2023-02-19,False
nrangel,meghan37,False,Gas however sense food.,1977-10-04,2020-05-10,False
nmitchell,john35,False,Be public total year instead.,1992-05-25,2021-05-27,False
randall81,cruzjoshua,True,Check Mr general issue.,1948-09-14,2023-05-20,True
myershannah,stewartnathaniel,True,Report way animal effect.,1995-07-19,2021-01-25,True
gabriellopez,dgonzalez,False,Every ahead movement health.,1974-10-10,2020-08-11,False
debra42,welchchristopher,True,Case management put man keep.,1962-11-22,2020-04-15,False
eric74,aprilbriggs,False,Pull lot may Mrs kitchen.,2000-07-20,2022-04-16,False
ronald47,ericwright,False,War state spring issue bed.,1977-01-22,2021-05-16,True
bradymelinda,phuffman,False,Answer rate mission far.,1953-07-22,2022-02-20,False
alexandria17,edgarwilliams,False,Into sure half.,1997-10-22,2020-07-27,False
acochran,hallbrittany,False,Defense great election idea.,1953-04-19,2020-01-03,True
hernandeznicholas,seanfernandez,False,Plan value just.,1962-10-24,2021-01-27,False
susan40,taylordavis,True,Item knowledge draw.,1989-01-09,2023-09-11,False
kelseyramirez,amandagonzales,False,Large well leg almost beat.,1996-08-31,2023-08-11,True
lyates,mendezjacob,False,Hair officer alone fact.,1996-01-05,2023-03-29,False
lisa31,wadedavid,True,Debate many weight me.,1957-08-15,2022-10-31,False
kristin72,alexander03,False,Answer through need.,1972-01-26,2022-04-27,False
jenniferknapp,nancy07,True,Institution more PM.,1981-05-02,2022-09-09,False
kevinhuynh,tannerchristopher,False,Herself analysis about.,1994-04-27,2023-07-25,True
mmorris,sarahoconnor,False,Fall develop music meet.,1986-09-09,2022-08-10,False
frostkristin,jose82,False,Well south staff local door.,1939-11-02,2021-10-11,True
brad87,jcain,True,Challenge eat ever.,1992-09-18,2021-06-06,False
alexandra16,asimpson,True,Factor old always travel.,1968-01-15,2023-03-15,True
amber97,nwilliams,True,Lay important north so.,1962-11-05,2021-02-02,True
costaemily,karen33,False,Already significant tax.,1988-05-21,2022-05-30,True
cwhite,whansen,False,Change whose leave watch.,1991-07-18,2020-03-31,False
sheila52,amanda04,True,Success nor public process.,1966-06-13,2023-03-06,True
ashaw,timothyoliver,False,Produce center that think.,2004-05-12,2020-04-25,False
anthony07,brownmegan,True,Human gun table goal.,1962-05-14,2022-10-31,False
charles98,hodgesamy,False,Build again suffer factor.,1941-02-16,2021-03-24,False
davidmatthews,dustin30,True,Next east father technology.,1986-04-18,2023-12-01,True
reneeherrera,zgarcia,True,Night music far recently.,1950-09-07,2021-10-07,True
angela32,xhill,False,Physical role stand.,1953-01-12,2020-10-07,True
dryan,walterowens,True,Sort movie federal.,1941-10-03,2022-11-01,True
thomaschristopher,urobinson,True,Need oil hot. As up behavior.,1963-05-22,2020-10-08,False
pyoung,akent,True,Like chair this guess.,2000-03-13,2020-01-09,True
gordon20,lwhite,True,Dog yet forward may week.,1948-08-11,2022-10-12,False
medwards,mestes,False,Like star enjoy.,1980-07-19,2022-04-19,False
christywarner,michaelruiz,False,Daughter wonder relationship.,1941-02-26,2022-08-22,False
ianderson,michael76,True,Hit growth week along.,1989-06-11,2020-04-05,False
danielblake,yhale,True,Outside although along.,1955-06-08,2022-02-09,True
garrett03,toddjackson,True,Smile hair provide.,2005-05-30,2020-01-21,True
meganbrown,jasonbrown,False,Become cold once finish not.,1985-03-13,2020-07-24,True
middletonmichelle,christopherchavez,False,One way like physical.,1965-05-25,2023-03-11,True
sarah53,garciamary,False,Account reason glass out off.,1966-01-20,2020-06-09,True
jimmy25,courtney99,False,Table than north social.,1998-03-22,2023-07-16,False
jfisher,tsoto,False,Upon feeling buy service.,1993-06-17,2021-09-02,False
cortega,elizabethchandler,False,Floor bad language tax talk.,2000-06-24,2021-07-06,False
nelsonjohn,fpatel,True,Purpose eat north hit threat.,1940-12-31,2023-11-08,False
gregory40,hboyd,False,Away blue him education.,1969-12-01,2023-04-24,True
wcaldwell,dbradley,True,Design heavy present measure.,1970-05-30,2020-11-22,True
kristen52,parrishapril,False,Try lawyer population arm.,1952-03-28,2022-10-12,False
robinsonpreston,butlersherri,False,Someone one low cell.,1953-07-18,2022-01-09,False
gjohnson,uparker,False,Face doctor relate answer.,1977-04-17,2022-06-25,True
griffinerica,pamelagonzalez,False,Wear executive hit risk week.,1981-09-15,2020-09-02,False
william34,kwilson,False,Sort take bad house.,1969-04-18,2022-09-27,False
michael60,odonnellbrett,True,Moment remember respond yes.,1968-01-05,2020-07-20,False
ihardy,youngjessica,False,Black discuss write letter.,1947-11-07,2021-12-26,False
yhenderson,mayerchristopher,True,Remain fact crime.,1975-09-23,2020-06-04,True
johnsherman,udonovan,False,Marriage time crime think.,1966-06-04,2021-06-16,True
raymond18,bshaw,False,Some finish notice.,1953-09-04,2021-03-27,True
johnsonryan,graybarry,True,Likely fly appear.,1952-07-20,2023-03-17,False
uferguson,danielburgess,True,Shake plant past able ever.,1955-04-10,2023-05-22,False
wday,rhernandez,True,Little side heavy gas rest.,1980-12-01,2021-12-08,False
kimjohnston,ashleyperez,True,Another region identify.,2006-03-03,2023-06-21,True
heidi77,aguirremelissa,False,Run course according.,1986-02-17,2022-04-28,False
robinsonapril,robert56,False,Coach life dream choose late.,1945-02-08,2021-10-30,False
carmen14,kristenruiz,False,Pick ten tax soldier.,1970-05-14,2023-06-14,True
malonewanda,paul16,False,Woman take agency now.,1965-03-21,2020-05-19,True
dshepherd,vargasalex,True,Increase right focus find.,1938-08-21,2021-06-30,True
awarren,peterzimmerman,False,Plan either wife.,1960-05-30,2022-10-19,True
matthewdiaz,carla45,False,Board paper these same.,1961-09-19,2021-02-26,True
jessica53,whernandez,True,Activity some without Mrs.,1947-02-06,2022-10-09,True
pamela72,connor87,True,Back star sense could just.,1939-07-28,2023-12-13,False
alexander94,hortonbrandon,False,Simple level project.,1950-04-17,2023-10-21,True
amandabarr,gabrielarias,False,Really fact over ready admit.,1965-12-22,2021-09-03,True
walterstracy,scottmarsh,True,Work fall challenge.,1948-04-09,2023-12-20,False
michael43,baldwinsteven,False,Across same dog mouth.,1985-04-10,2022-09-27,True
christyriley,vwilliams,False,Coach into agreement site.,1957-09-27,2021-08-15,False
randynguyen,mbrown,True,Experience his law.,1941-11-26,2021-05-09,False
mirandahansen,klewis,True,Skill fast buy.,1993-09-24,2021-10-04,True
stevenflowers,emolina,False,Push itself according claim.,1960-06-06,2022-11-29,True
melanie42,greenamber,False,Perhaps girl factor standard.,1947-11-04,2022-07-15,True
blankenshipscott,douglasbrown,False,Concern while let.,1952-11-05,2021-05-25,True
peter13,robertssheena,False,Rule day modern wall middle.,1962-06-30,2024-03-17,False
xortega,jsilva,True,Under oil mention away.,1961-12-23,2022-07-03,True
jacoblopez,eaguirre,False,Himself paper every her.,1948-10-25,2024-01-07,False
kevinbest,nunezjennifer,True,Born house yeah return some.,1967-05-03,2023-12-10,True
stephanieperez,ehendrix,True,Although program at.,1978-03-18,2020-01-13,True
roberthernandez,megan82,True,Change above go garden.,1945-03-21,2021-09-22,True
hrodriguez,corey14,True,Focus meeting ever.,1954-05-19,2020-02-08,True
isabel36,croy,True,Relate long require kind.,1998-12-29,2023-07-03,True
codybaldwin,kbernard,False,Fund career him lawyer star.,1966-02-24,2023-11-23,False
cynthia57,bellgabriel,True,Her today hair film standard.,1952-01-08,2020-10-06,True
kristi07,danielcisneros,True,Arrive back turn.,1970-04-24,2021-10-05,False
dunnmarco,lgonzalez,False,Road point on character.,1963-09-29,2022-05-16,True
andersonkenneth,christine58,False,Per quality not now if.,1946-03-03,2020-09-05,False
buckleysarah,lisadavis,False,Occur expect look low yet.,1983-11-19,2020-01-19,False
tstuart,jamesvaldez,False,System season stay.,1972-02-09,2022-12-31,True
karen36,dana86,True,Provide throw movement.,1978-03-06,2024-04-01,True
lisa15,darleneflores,False,Bill look prevent fill.,1996-10-20,2021-11-20,False
robertsdaniel,sheltonkaren,True,Share there avoid care.,1972-12-02,2021-04-25,True
dustingreene,craig63,False,Size set phone.,1972-12-05,2021-09-21,False
jeffrey44,paullisa,False,Investment system place.,1954-01-02,2021-07-31,False
tiffanystrong,blozano,True,Series side sort born theory.,1997-12-01,2022-06-04,True
timothy04,abrown,False,White ability girl.,1941-10-16,2022-05-04,True
fholt,richard80,False,Career bit start.,1993-07-31,2020-04-14,True
hubersylvia,jonathan23,False,Public some police.,1976-06-08,2023-01-08,True
craigmartinez,haynesmaurice,False,Impact but by it.,1979-02-16,2023-02-12,False
jonathan88,fjohnson,False,Dog apply music would.,1942-04-03,2022-12-18,False
stephanie42,sarasantos,True,Black help skin.,1941-10-15,2021-02-22,True
amandagarcia,falexander,True,Quality inside language.,1947-08-28,2021-12-25,True
crystal97,juliewashington,True,Through range suddenly.,1991-03-20,2023-09-28,True
daniel85,phoffman,False,Need turn turn impact group.,1990-03-09,2023-11-15,False
halljorge,ohaynes,True,Back carry free race state.,1945-03-22,2022-11-13,True
denise08,evanjackson,True,Add voice itself ball.,1989-11-14,2023-01-29,True
andrewcampbell,erin43,True,Space full drop seek prevent.,1946-01-26,2021-06-09,True
emaxwell,dustin79,True,Add simply recent power.,1973-03-13,2023-03-07,True
david49,bmorrison,False,Pretty cup bad.,1946-02-22,2023-02-24,True
caitlinwood,charlescastillo,False,Town save when debate main.,1970-06-14,2022-01-17,False
alvarezjeffrey,jennifermunoz,False,Go test often fine.,1952-03-22,2022-06-10,False
karenmeyer,yolandasmith,False,Mission practice group.,1988-06-20,2020-10-15,False
bhernandez,gonzalezjared,False,Region inside future reach.,1997-03-07,2021-06-24,False
justin91,andrearobinson,False,Stand add three tough take.,1945-08-17,2024-01-22,True
bmolina,davenportpaul,False,Treatment until need similar.,1990-12-11,2022-08-01,True
whitebrian,jacquelinecollins,False,Action type can parent.,1940-08-06,2021-05-09,True
ulynch,chavezamanda,True,We hear sense last.,1941-09-25,2021-03-16,False
qturner,cochranbrian,True,Single home can may natural.,1992-12-16,2021-01-16,True
jamesbaker,craigbrady,False,Democratic value how.,1970-08-09,2022-05-03,True
molinaraymond,ngibbs,True,Think second enter.,1946-11-01,2020-05-08,False
tammy67,lisamcdowell,True,Same through go debate often.,1938-11-25,2023-09-29,False
matthewwolf,garciasean,True,Wait late thought statement.,1952-01-27,2021-06-10,True
jamesromero,scottstevens,True,Ok today back attention.,1964-05-22,2022-07-25,False
allenmelissa,jessicasims,False,Third part vote daughter.,1972-02-05,2020-11-26,False
hahnsandra,heatheraguilar,True,Do evidence edge form test.,1977-04-15,2022-11-18,False
bennettjames,carpenterapril,False,Key cultural least both.,2000-10-20,2021-04-29,True
ashleygriffin,drangel,False,Network president poor rest.,1962-09-01,2023-09-30,False
cummingskelly,chasephillip,True,State some class yourself.,1982-04-21,2020-09-16,False
jesse61,patricia49,True,Street order employee gas.,1958-12-18,2022-08-24,False
thompsonapril,qbrown,False,Show inside professor.,1967-09-27,2023-10-01,True
jennifer84,mooreandrea,False,Design stand direction.,1992-05-15,2022-06-15,True
lopezryan,lindashepard,False,Billion claim learn huge end.,1960-06-05,2024-01-24,False
jasonramos,sarahramos,False,Today last argue sense.,1971-05-26,2020-07-11,False
markarmstrong,joan91,False,I rather already.,1988-06-14,2023-04-03,False
vknight,jennifer48,False,Draw several group.,1984-03-06,2020-09-30,True
billy47,waltersteve,False,Kind book people agent only.,1957-06-01,2022-05-19,True
shelbymelton,gordonellen,True,Hair trial war prepare.,1972-12-19,2021-10-13,False
eric75,bernardregina,True,Challenge month leave.,1958-12-02,2022-05-30,True
weeksalexandra,whitneyhorne,False,Across old share they think.,1992-02-03,2022-10-23,True
jgibson,hendersonjudy,True,Along shake clearly finish.,1955-07-25,2020-10-12,True
lauren30,slewis,False,Research law choose view.,2000-11-24,2020-12-03,True
ann94,sullivancindy,True,Letter sense as training.,1980-09-13,2024-03-31,True
isosa,aaron66,False,Fine sport road recognize.,1982-11-21,2023-08-14,True
colleenwebb,pittmanstephen,True,Analysis bit crime arm.,1977-02-27,2021-06-13,False
santosrichard,charles36,False,Never course success sense.,1995-01-28,2021-10-11,True
dlogan,thomas93,True,Seat bit necessary.,1998-04-05,2023-10-16,True
tiffany20,bsheppard,False,From wife rise.,1982-12-13,2023-02-10,False
laurenford,eguerrero,True,Become assume walk.,1980-09-06,2021-10-18,False
belinda23,lynnsara,True,General onto cold a.,1993-07-26,2021-10-29,False
brendajimenez,tjohnson,True,Establish quite much.,1966-11-27,2020-12-26,True
travis29,ybryan,False,Maintain prove cold can.,1968-12-27,2023-08-29,False
anthony24,lopezjustin,False,Official easy myself.,1992-09-24,2021-07-12,True
hintontyler,monica55,True,Mr task affect carry.,1986-09-26,2023-11-28,True
debbie33,pstanley,False,Line enough range boy save.,1953-07-05,2024-01-20,False
brivera,zandrews,False,As plan any.,1974-05-19,2021-02-07,True
lauramitchell,kevinpugh,True,Music there daughter.,1960-08-21,2022-12-09,True
akoch,collinsemma,False,Media campaign poor capital.,1949-03-17,2022-01-24,True
mnovak,susan32,True,Water by range my find.,2002-11-21,2022-11-15,False
hernandezlaurie,hedwards,False,Show something culture.,1982-10-07,2020-11-06,True
patricia31,hernandeztravis,True,Consumer itself value.,1961-09-21,2023-08-03,True
elizabethrichardson,anthony83,False,Wrong attorney have.,1969-10-31,2022-02-28,True
ballanne,joshuagreene,False,Social all trip.,1958-09-20,2020-11-09,False
kmyers,richard50,True,Among wish perform day maybe.,1983-01-19,2021-05-08,True
lisasantos,vleonard,False,Goal economy health about.,1993-08-15,2022-10-22,True
xparker,vlewis,False,Even right run money.,1972-05-24,2021-10-15,True
mossdouglas,castilloalejandro,False,Plan voice now south.,1993-06-28,2023-02-06,True
tsnyder,martinsavannah,True,Before Democrat into.,1985-04-26,2021-09-27,False
deannayoung,curtis75,True,Light lawyer eight either.,1939-10-17,2022-11-18,False
kendra06,alexislove,False,Behind visit far thing.,1973-02-11,2021-11-07,True
smiththomas,jasongoodman,False,Skill free a race wide.,1978-08-10,2022-06-05,False
sandra13,greergabriel,False,Itself ok so.,1991-10-03,2023-03-18,True
charlespaula,jowen,True,Many kitchen smile surface.,1953-03-19,2020-09-18,False
johnny99,brandon99,True,Large media from card seven.,1954-03-08,2020-06-09,False
hannahraymond,jacobhernandez,True,Character phone yeah senior.,1955-09-06,2023-02-09,False
katiegriffin,erickline,True,End method should wall.,1938-11-09,2021-02-28,True
hubbardmatthew,acuevas,True,Us cell without.,1981-03-02,2022-11-19,False
trosales,cgarner,True,Big blue view particular Mr.,1974-10-10,2024-03-14,True
robyn00,terry20,False,Author add draw.,1976-11-14,2023-11-24,False
eric78,williamslisa,True,Party difference forget seem.,1958-09-07,2024-01-20,False
wrightpeter,npetersen,False,Billion speech contain prove.,1993-10-24,2020-04-22,True
debradiaz,usmith,False,Chance million win new.,1970-08-07,2020-04-14,False
adrian12,john62,False,Level chair small.,2004-09-24,2021-09-24,False
davidsonangela,erikhayes,False,Special area key along vote.,2002-07-19,2022-03-17,True
karengreene,hinesmichael,True,Change any key toward.,1961-09-28,2024-03-21,True
dwalker,lisa32,True,Group necessary thus.,1970-04-05,2023-06-11,True
eboyle,kennedyjohn,True,Learn new forward fight.,1958-01-09,2023-10-28,False
wallacediamond,nicholas78,False,Whether country know less.,1990-10-20,2021-01-12,True
madison26,william23,True,Machine bed no memory upon.,1956-05-20,2023-09-07,False
westmichael,solomonrachael,True,Or several bag.,1961-01-06,2022-11-26,False
johnmccullough,georgecardenas,True,Color skill base together.,1951-04-01,2020-03-29,True
andersenbarbara,thompsonmaxwell,True,Certain theory enough.,1992-01-30,2020-11-29,True
tgraham,ywilkinson,False,Six use civil act.,1999-06-29,2022-11-22,True
donna19,jamescoleman,False,Soldier any chance.,1987-06-29,2023-10-15,False
youngrobert,vroberts,False,Parent rich nor sort.,1970-04-03,2022-07-25,True
kmcdaniel,erogers,False,Factor discuss air.,1977-12-09,2023-12-08,False
kenneth20,courtneyvelazquez,True,Base tax could military.,2003-08-05,2022-01-21,False
hailey17,tammywoods,True,Wide form particular course.,1982-12-05,2022-12-11,False
carterjoshua,tylermiller,False,Right result garden.,1938-07-19,2024-03-12,True
sandrahamilton,jasminehuynh,False,Successful from last action.,1972-07-26,2022-07-21,False
collinsalexander,yunderwood,False,Similar late standard leg.,2002-03-14,2022-07-09,True
joshua69,erika87,True,Goal fear artist some.,1947-10-05,2022-04-29,False
pamelaunderwood,jennifer26,False,Green sure total tax get.,1975-10-30,2022-04-16,False
sarahramirez,cheyennewilliams,True,Activity over particularly.,1957-02-08,2023-01-04,False
alvarezthomas,scottlarson,False,Speech add race film.,1987-04-16,2021-11-11,True
feliciasnyder,zmadden,True,Everybody full page affect.,1975-07-26,2020-12-31,False
williammedina,nunezwesley,False,Condition throw rule risk.,2003-08-21,2022-04-30,False
qkoch,lawrencemckay,False,Include agent clearly much.,1977-04-01,2022-03-03,True
terri11,usmith,False,So indicate build.,1954-01-25,2022-09-11,True
richardwilliams,shirley38,True,Me still identify mean.,1975-12-18,2021-12-23,True
wcarter,browndonald,True,Box own wait hold process.,1943-05-25,2023-02-13,True
kreid,clarkelizabeth,False,Might only each.,1938-05-12,2024-02-13,True
thudson,gomezmary,False,Kind board save behavior.,1956-10-11,2020-04-22,True
freemanjamie,richalexander,False,Memory training since.,1974-05-23,2021-05-26,True
jenniferpatterson,zacharyclarke,False,Time law offer figure.,1954-01-03,2020-10-23,True
frances12,alejandro88,False,Item despite make character.,1983-03-01,2022-03-27,False
brent07,pdunn,False,Relate occur care save green.,1944-12-18,2020-01-25,True
brandonkennedy,castrocameron,True,Section spend maintain.,1974-04-21,2020-08-11,True
mccallpamela,michaelmontoya,False,Social officer dream run.,1945-01-15,2020-04-02,True
austinmichelle,toddallen,False,Test benefit at whom else.,1961-02-11,2023-11-24,True
taylormichael,reynoldswalter,False,Give ok worker break.,1954-07-16,2022-11-04,True
smalljacob,nicole43,True,Over long former beat.,1953-12-10,2023-11-30,False
claudianewman,sharihernandez,False,Science itself control.,1949-11-11,2023-08-11,True
codygiles,rossjeffrey,True,End voice happen think.,1979-05-05,2022-11-23,False
davisvanessa,ksmith,True,Likely successful police out.,1983-04-21,2023-11-14,False
josephclark,florespaul,True,Newspaper language hard have.,1945-05-01,2023-07-11,False
vanderson,ericmartinez,False,Finally open smile baby.,1975-04-09,2020-03-04,False
cuevasgina,alvarezjose,False,Half black economic fact.,1987-05-05,2022-05-30,False
jason78,crystalfisher,True,Before name catch what.,1996-05-29,2021-11-30,False
