Tag,Username,Blue,Description,Birthday,Joined_on,Is_profile_public
davidharrison,tmolina,False,Physical check yes dog win.,1950-02-21,2020-08-09,True
jimmy33,robert62,True,Father thus mean kind have.,1977-03-26,2023-04-22,True
jonathangonzalez,kathleen32,False,Low the pass home your.,1992-07-30,2020-10-02,True
edward98,lindseykelly,False,Successful run benefit baby.,2005-09-09,2022-08-28,True
terrellmartin,josephcampbell,False,Vote either TV heart.,1993-09-24,2023-09-07,True
qdaniels,njackson,False,Me religious though fill.,1961-01-11,2023-03-02,True
caitlin78,christopherhernandez,True,School point animal mean.,1986-03-03,2023-11-25,False
franciscoproctor,ewest,False,Son free gun side list.,1953-11-27,2020-09-11,False
alexandriasmith,perezmary,True,Finish growth whatever.,1966-04-24,2023-04-23,True
tarabaker,tammysimpson,False,Peace long kind.,1945-08-23,2022-12-25,False
shannonjenkins,stephensonjamie,False,Rich think own off computer.,1970-09-22,2022-12-22,True
dawn80,jeremylivingston,False,Always boy on remain.,1959-10-21,2020-09-29,False
wattsmaria,qturner,True,Sell before senior movie.,1979-10-10,2021-10-22,False
andrewgates,hallbrooke,False,Sit site memory technology.,1948-03-04,2021-12-16,True
rogerroberts,gregory21,False,South service mission wall.,1957-05-17,2022-03-28,True
hernandezsteve,angelachapman,True,Several wall try we affect.,1966-10-05,2021-09-06,False
qbailey,beckywashington,True,Short same word.,1945-08-01,2022-02-23,True
mwatson,kimberly83,False,Contain eye behind tough.,1963-02-09,2021-03-28,True
wlivingston,dmassey,True,Prevent note visit sell ago.,1959-11-13,2023-12-08,False
zachary75,gonzalestimothy,False,News word protect.,1942-06-16,2020-09-29,True
estevens,ubennett,True,Not in act.,1978-01-03,2023-10-31,False
johnsonkari,bryan85,False,For thus throw commercial.,1992-03-07,2023-06-30,False
michaellarsen,graybrian,False,Phone culture rule read.,1988-02-14,2021-08-21,True
tiffanyedwards,irodriguez,True,Old ok her already.,1944-02-09,2022-09-10,False
smoreno,cynthia37,True,Under film mission event.,1988-03-19,2024-03-23,True
phillipsashley,tamara14,False,Value hotel use.,1981-08-27,2021-02-10,False
irwinbenjamin,wcox,True,Special these billion nearly.,1994-07-14,2022-05-03,False
emily01,wyatttabitha,False,Firm born condition anyone.,1999-04-15,2020-05-01,True
alexissullivan,frose,True,Live certain eye personal.,1976-07-20,2020-06-18,False
michellegarrett,jonessherri,False,Area eat game write believe.,1951-03-13,2024-03-02,False
manueljohnson,thomasangela,False,Name for way third carry.,1945-02-28,2023-05-23,True
samantharobinson,toddstone,True,Rise guess lawyer ago need.,1985-08-01,2020-06-11,False
fitzpatricknicole,bjohnson,False,Take low early card.,1995-01-21,2020-04-03,True
jimmyperez,cmcintyre,True,Campaign audience wall.,1968-01-09,2020-01-10,False
katherinesaunders,taylordavid,True,Without start upon avoid lay.,1993-11-03,2021-05-14,True
kara62,cynthia21,False,Member now able eat.,1992-08-22,2020-03-23,True
vthompson,ramossarah,True,President method your time.,1966-04-09,2022-01-19,True
alison46,herreratracy,False,Class such increase.,1998-12-20,2021-02-15,False
james71,amy34,False,Some government two.,1992-10-06,2020-09-03,True
smcneil,zwhite,True,Until coach be hotel.,1946-02-23,2020-03-01,False
daniel63,mcintyrejulie,True,Character power tend.,1988-11-10,2021-05-30,True
erikapowers,edward77,False,Senior late church.,1987-11-05,2023-04-04,False
kristin67,theresa32,False,Send window away often final.,1946-10-03,2020-05-06,True
diane75,ibishop,False,Yes join some.,1960-05-15,2022-11-15,True
xrodriguez,richardsonchristopher,False,Citizen family use fire.,1941-06-14,2024-03-24,True
rtran,kenneth36,True,There play cost onto.,1958-05-31,2022-05-01,True
evansanita,abbottrichard,True,Guy term country.,1958-02-26,2023-01-24,False
jacksondylan,ubowman,False,Idea job country finish.,1953-07-09,2020-02-10,True
sloanjason,elizabeth29,False,These management although.,1938-05-02,2020-08-31,True
hvaldez,stephanie28,False,Share half do scene.,1980-04-23,2020-11-28,True
kochjill,jacksondonald,False,So left case audience kind.,2005-10-04,2020-01-25,False
nicholasarias,johnathan25,True,Rest technology gas.,1981-07-21,2023-05-21,False
wjackson,scox,False,With life return job.,1975-11-25,2023-05-17,True
dean31,willisgabrielle,True,Give away avoid issue a big.,1953-03-15,2023-08-15,True
rlewis,armstrongstanley,True,Avoid father hope across.,1943-03-09,2023-10-30,False
johnsonian,qsparks,False,Real seem record suffer.,1982-07-15,2021-04-16,True
boylekatie,jmiller,True,Box marriage here itself.,1952-01-22,2023-03-07,False
bjohns,colemanjesse,False,Doctor our those certain.,1996-03-19,2022-08-09,False
rossjason,valerieburnett,True,Mother mention family.,1938-12-20,2022-05-17,False
pwatson,misty85,True,Allow happy phone.,1980-05-26,2023-02-03,False
robertlevy,ymcdowell,True,Above would far.,2002-05-15,2023-12-21,False
tgill,alexandrascott,True,Born ability per.,1984-09-25,2022-11-13,True
judithromero,megan21,True,Song very such next activity.,1986-05-27,2021-01-08,True
dfranco,aarontaylor,False,Doctor respond also expert.,2001-04-27,2020-09-18,False
michaelharper,treese,True,Sing assume head interesting.,1940-07-12,2021-09-16,True
jonessusan,joseph74,False,Music too everyone final.,1961-04-28,2021-05-15,False
angela30,reneeunderwood,False,Should former before.,1953-06-03,2022-07-24,True
xparsons,jason64,False,Our once feel sometimes.,1986-05-27,2022-07-16,True
russelllee,kirbyjames,False,Sell network break treat.,1962-06-15,2021-05-03,False
oconnelljohnny,hoffmanjohn,True,Time tell big miss every.,1957-12-19,2023-04-01,False
nancy77,barnettpatricia,True,Over dog happy right best.,1962-08-07,2022-11-26,False
angeladonovan,rachelthompson,False,Number staff Congress leg.,1942-03-21,2021-05-03,True
jeffery31,teresarodriguez,True,His simple research contain.,1996-08-20,2023-01-27,True
ashley99,samuel03,True,Recognize painting rate.,1941-05-06,2021-12-01,False
barbarakelly,timothybentley,False,Want result few point.,1978-01-22,2020-03-08,True
sextonnancy,summersvictoria,False,Play on herself somebody.,1943-01-24,2021-06-20,False
gjones,josephmayo,False,City what probably school.,1960-03-07,2023-04-14,True
fmayer,drewanderson,True,Focus interesting support it.,1975-04-29,2020-03-28,False
kimberly86,rblackburn,True,However keep space top.,1964-04-07,2022-08-01,True
rogersmitchell,kellymcclain,True,Later class other knowledge.,1942-05-29,2020-05-31,True
qbeard,davisdave,True,Less model beautiful those.,1941-07-25,2023-04-12,True
opatterson,kevin46,False,Eye former hope.,1941-02-24,2023-04-30,False
wjohnson,sarah03,True,Lose wide science.,2004-06-27,2023-01-06,False
ashley98,elliottheather,False,World with stuff few.,1978-08-18,2022-10-11,False
bellrebecca,cobbjason,True,Leg yet form benefit spend.,1973-08-16,2020-12-30,False
james68,hoffmantaylor,False,Above stock TV simple.,1938-07-26,2022-04-12,False
donna37,jennifer37,True,Ask offer identify hospital.,1951-02-04,2024-03-30,True
lewisrobert,barbarajohnson,False,Site news apply.,1981-03-03,2022-09-02,False
camachochad,ashley36,True,Trial food read happy.,2004-10-26,2022-12-07,False
melanie06,umartin,True,Run rate determine ok enjoy.,1976-11-25,2020-12-02,False
lcooper,grahamroy,True,Wall clearly available get.,1982-03-16,2023-02-25,True
ugoodwin,danielreyes,True,Maybe use light allow.,1988-04-03,2023-05-09,False
mary94,kjordan,False,Listen talk eye.,1961-04-26,2021-04-14,True
shawntorres,clifford49,False,Line unit address size.,1981-11-18,2021-12-09,False
jenkinschristopher,zgarcia,False,Threat high rich.,1972-12-28,2023-06-22,True
flara,carolyn89,False,None physical factor return.,1977-02-23,2021-08-14,False
pmartin,cthompson,True,Fire term chance front son.,1942-06-11,2023-12-29,True
dclark,elizabethwood,True,Concern into despite set.,1978-01-14,2022-03-28,False
andrew07,rhughes,False,Low rest fear still energy.,1941-09-18,2022-01-10,False
christopherserrano,kelly17,False,Itself east charge whole.,1974-09-10,2020-03-31,True
sara34,fernandezpamela,True,Contain six wall approach.,1948-10-07,2023-05-24,False
davidpayne,sarah37,True,Partner meet I.,1952-07-16,2022-12-12,False
eric01,cfigueroa,True,Owner recognize discuss.,1992-01-27,2021-11-15,False
espinozabrandi,xgraves,False,Option long both strategy.,1950-08-23,2024-03-01,True
zsteele,austin44,True,Entire hope left eat.,1949-06-30,2020-09-05,False
hweaver,deborah46,True,Partner more must other.,2005-11-25,2023-06-11,False
gmiranda,ethan80,True,Seven sing my.,1963-10-06,2020-12-20,False
davistiffany,stephenbailey,True,Hour prepare reason daughter.,1993-01-11,2023-05-27,True
morristina,david52,True,Hair standard challenge.,1977-04-07,2020-08-06,False
fhanna,edward73,True,Decide level very.,1969-12-15,2020-03-04,True
zmiller,paul83,True,Past second debate from rise.,2002-02-10,2021-04-03,True
jimenezdanny,edwarddickson,False,Just board job describe.,1985-04-15,2022-07-13,True
brianrasmussen,mcase,False,Run positive various.,1985-05-26,2024-03-04,True
dana36,richardsonanne,False,Discover huge image music.,1983-08-11,2024-03-23,False
deanrichard,yhuber,True,Father buy work health clear.,1991-07-27,2023-03-17,False
sherigood,knoxchristopher,True,After bag serve appear.,1954-03-15,2020-09-03,False
justin18,laurenmcconnell,False,Civil every now rest.,1992-04-20,2023-08-04,True
danieljones,gregory82,True,Break region customer rich.,1984-02-22,2021-09-29,True
adamrobbins,franklinwalker,False,Usually glass probably.,1987-02-18,2022-01-28,False
bailey67,brownashley,True,Unit four traditional writer.,1963-02-18,2022-03-18,True
uhenderson,amymyers,False,Treat thank pressure fact.,1996-04-28,2020-01-16,True
kristinpalmer,johnross,True,Young once similar.,1997-11-26,2021-03-13,True
alyssa09,dorothy43,True,Single explain should.,1982-01-27,2023-07-27,False
davidnguyen,xproctor,False,Daughter buy heavy get.,1971-11-21,2022-04-14,False
paulrice,kimmelanie,False,Will argue by state series.,1971-02-05,2024-01-13,False
stephen34,adam88,True,Tonight brother him moment.,1964-02-27,2020-08-19,True
qlewis,spencerbrittany,False,Memory five operation.,1966-08-26,2023-11-21,True
kholland,ashleylopez,False,Know together interest catch.,1945-09-25,2020-12-29,True
vriley,brownalexa,True,Maybe last world.,1940-05-16,2022-05-28,True
kellyward,kimberlymoody,True,Upon majority garden far so.,1941-01-09,2020-06-30,True
coopervictoria,cmcdaniel,False,Probably turn church hair.,1987-08-06,2023-03-02,True
imurphy,heatherfowler,False,Court enjoy country.,1978-07-13,2020-04-13,True
mark33,jessicagross,True,Note whose color everyone.,1992-02-20,2020-02-20,True
stephanie49,kimberly31,False,Left training man marriage.,1999-09-07,2024-04-01,True
caitlincox,kathryn59,True,For police major out teacher.,1996-11-07,2021-11-17,False
tsmith,kaylajohnson,False,Soldier old approach product.,1983-03-10,2020-09-05,False
ryan34,wellsmarie,False,Low back it into right share.,1960-09-05,2021-07-29,False
andrew22,sheryljones,False,Up myself heavy.,1987-05-23,2020-10-18,True
grahamwilliam,katherineevans,True,Leg wrong personal who.,1987-06-19,2022-10-20,True
dawnjohnson,jenningsmark,True,Same social discuss true.,1987-09-10,2020-06-14,True
jacksonrodney,stevenblackwell,True,Upon church guy.,1945-06-23,2021-07-14,True
tbrown,teresahart,True,Wide hear scene history.,1995-12-07,2023-08-27,True
deanpatel,autumngreen,False,Address bag there.,1946-05-03,2022-12-08,False
robersonmarie,wperez,True,Magazine follow season let a.,1948-05-15,2022-04-20,False
martinezholly,brianhartman,False,Feel road to teacher.,1986-08-24,2022-07-29,False
esalas,ogray,True,Appear laugh area staff.,1960-05-14,2023-05-25,True
amycunningham,wilsoncharles,True,Spend whom front let.,2000-02-04,2022-10-13,False
qjohnson,colebuchanan,True,Perhaps blood north ok.,1972-03-20,2022-10-06,True
valerie61,tonya67,False,Those law it outside.,1999-06-28,2023-07-01,False
geraldlopez,ssmith,False,National people direction.,1949-01-24,2022-08-03,False
andrew68,castanedamark,False,Wear always wide.,1997-04-03,2021-01-13,True
sallychandler,kellymitchell,False,Data hundred role that.,1940-03-28,2024-02-20,True
joanna30,gharmon,False,Field create water nor.,1951-02-26,2021-10-02,False
denisewilson,robert86,True,May lay rule professor none.,1971-03-22,2022-03-07,True
sanchezjessica,harmonkenneth,True,Such way she market soon.,1968-04-29,2024-04-02,False
kathryndunn,jennifer92,True,Nation mind some drug.,1957-12-16,2021-04-22,True
rhurley,jason12,False,Capital chair because plan.,1990-11-22,2021-02-15,True
derek12,fmoore,True,Wish American society indeed.,1986-01-05,2020-11-06,False
ryan28,osantos,False,Day know effort end.,2002-08-04,2020-05-27,False
craigriley,vgates,True,Child foot win.,1952-01-22,2023-03-10,True
natasha19,bruiz,True,Many yard friend fast.,1950-10-05,2020-02-13,True
srichardson,allison10,True,Nation you whole leader.,1968-04-05,2023-04-27,True
johnsonkyle,whiterichard,False,Performance also charge.,1991-03-10,2020-07-28,True
adamsholly,martinlewis,False,Decade evidence what entire.,1949-07-27,2023-11-01,True
monicabailey,lward,False,Wind than up condition.,1962-05-30,2021-07-09,True
gloverdanielle,mooneyjesse,True,Case consumer of adult.,1945-03-16,2020-02-07,False
kristinebrown,robert93,True,Interesting become defense.,1999-10-18,2021-06-21,True
angela85,rchoi,False,Clear term seat entire.,1941-05-29,2023-10-11,True
juliabrown,donaldswanson,True,System off best rise.,1969-10-28,2022-09-15,False
amandaperez,derek00,True,Author south idea soon.,1938-06-09,2020-05-23,True
littlesteven,patricia79,False,Describe wife national south.,1955-10-23,2022-05-02,False
edward88,tsullivan,True,Production early technology.,1964-03-05,2022-04-27,True
jennabradford,krausebrian,False,Remain price between.,2000-12-30,2021-05-17,False
tedwards,josephvance,True,Impact analysis try case.,1944-08-08,2023-06-25,True
ruiztammy,bmartin,False,Check difficult risk serve.,1968-07-25,2020-11-18,False
sweeneycole,branchadrian,False,Fear reach whose decide seat.,1968-11-12,2020-09-15,False
josephchapman,danielsanchez,True,They six officer.,1989-12-05,2020-01-28,True
lauren12,elizabethdaniel,True,Tell key fall cause.,1977-03-02,2024-01-01,True
amay,clarkcatherine,True,Term true clear its.,1982-06-19,2020-02-27,True
rhess,lejohn,True,Challenge team with both.,1973-05-25,2024-03-21,False
parkerjeff,littlekristopher,True,Scene our raise office other.,1972-02-19,2023-10-18,False
arose,hendersondenise,True,Which source lay.,1949-09-16,2021-07-13,False
natashamccarthy,jamesrodriguez,False,Drop job chair we friend.,1961-09-15,2022-01-04,True
julia50,maryfrank,False,Degree and relate our above.,1955-09-27,2022-02-10,True
juliehardy,sandovalallison,False,Raise bar prepare baby.,1950-04-27,2023-05-14,False
elizabeth79,chavezjames,False,Sense foreign leg.,1961-09-08,2023-03-02,True
chasemercado,rprice,True,Child company total offer.,1950-01-20,2022-06-18,False
harrellkeith,michelle57,True,Machine realize Mrs.,1971-02-21,2023-11-24,False
jasongonzales,james06,True,Religious their a.,2002-10-06,2023-04-30,False
jhenry,lauradickerson,True,Old food ago what.,1952-02-26,2020-01-08,True
richardspencer,martinjonathan,False,Edge result clear red.,1978-02-11,2020-02-06,False
patelgeorge,feliciajones,True,Nor school memory.,1962-02-13,2022-12-12,True
nicolebrown,melvinfoster,True,Year full those six all whom.,1963-02-20,2021-07-18,True
david06,miabrooks,False,Life so floor last.,1964-04-11,2022-08-16,False
nicole52,ydouglas,False,Dream call rather goal.,1989-11-26,2020-02-08,True
martinashley,alejandro18,True,Page might ten according.,1952-11-10,2020-04-20,False
sara49,curtisrodriguez,False,Their former realize.,1969-10-16,2021-01-31,True
joshuaharris,collin09,False,Budget draw page spend.,1972-08-15,2022-02-07,False
tsherman,mayerdonald,False,Lose mother high free human.,1952-06-16,2021-01-19,False
catherine77,ianjones,False,Where main mention.,1970-09-05,2024-03-22,True
bonnie97,ggarcia,False,Law daughter tree leader.,1966-10-30,2023-01-11,False
rmiller,robertdavenport,True,Relate herself director huge.,1987-05-29,2022-11-14,True
keithholder,laura61,False,Decide quite matter director.,1973-08-16,2022-09-11,True
rluna,browncory,False,Less work from ever.,1957-04-01,2021-03-30,False
heidi70,michelehensley,False,Reality their success which.,1995-05-15,2023-04-23,False
lewistammy,elizabethperkins,False,Wish listen politics term.,1975-09-12,2021-11-08,True
natalie76,joeltaylor,True,Dinner carry expect anything.,1972-02-10,2021-12-24,True
garciajessica,igriffin,False,Suddenly fact treat door.,1977-08-15,2022-03-24,True
warrenalexander,megan77,False,Trip step when occur hit.,2004-02-20,2022-05-20,True
jillian52,ajones,False,Its trade pretty total.,1969-04-03,2023-07-22,False
allen80,harrisjohn,True,Reality why six remain.,1968-10-04,2020-07-20,False
phernandez,williamreyes,True,Service visit many set.,1976-05-21,2024-02-06,True
mary16,leonardfred,True,Low similar ground east.,1973-03-04,2021-08-31,False
lgarcia,jenkinsbrittany,True,Lead film subject officer.,1985-06-01,2021-05-06,False
destinyperez,vasquezwilliam,True,Change anything measure.,1956-06-22,2023-09-05,True
garrisondenise,johnkim,False,Hour group guess him people.,1972-12-28,2024-02-14,True
rachael20,dawn34,False,Form think number he several.,1943-03-06,2023-02-18,False
burtonrichard,christopher90,True,Open east more talk.,1984-08-13,2022-03-27,False
melissa69,hansenkeith,True,Some who material.,1989-03-16,2022-11-08,True
jordandavid,katherine26,False,Agree either wait piece data.,1958-11-06,2021-03-24,False
zmcdaniel,sherryhale,False,Practice across must become.,2001-09-03,2021-11-12,True
latoya84,bakerjessica,True,Couple service gas unit.,1984-02-08,2023-09-30,True
marissa23,lisaware,False,Care always list once.,1998-03-17,2021-11-03,False
amandaknight,annemyers,False,Go purpose building both.,1998-08-25,2020-02-19,True
hstewart,alexanderwoods,False,Lawyer get car wide.,1965-03-07,2023-12-21,True
sherri88,christinaboyle,False,Attack least senior.,1954-01-01,2020-04-20,True
johnsonandre,kbennett,True,Home newspaper school site.,1945-06-09,2022-12-24,True
dlarson,jessemorgan,True,Mention effort explain type.,1972-09-01,2023-03-21,True
gwilliams,tiffanybrown,True,Often nothing recognize east.,1997-07-01,2022-04-21,False
cortezbrandon,zhangallen,False,Officer remain ground.,1944-07-21,2023-01-29,False
ponceamy,craig92,False,Picture career manager again.,1946-10-24,2020-02-28,True
lirwin,grantadam,False,Lay what theory middle.,1938-12-08,2020-05-12,True
zdavid,rossrobert,False,Bed serve set.,1955-09-11,2020-03-07,False
wilsoncynthia,wgomez,True,Account onto friend case cup.,1943-03-14,2020-07-01,True
madkins,james29,False,Computer behind begin above.,1961-11-29,2023-05-19,False
erik68,zmay,False,Day left Republican energy.,1947-07-09,2024-01-30,False
donaldsondonna,linda88,False,Them forget investment bed.,1996-11-17,2020-06-13,False
pwilliams,holdenaaron,True,Guess song recently sister.,2005-04-18,2023-06-03,True
hughescathy,nicholspeter,False,Leave hope receive else gas.,1959-12-02,2020-02-05,True
skrueger,raymondjordan,False,Wait eight idea call catch.,1938-09-10,2020-06-14,True
randallchavez,nmata,False,Kid her reason employee.,1972-03-06,2022-10-18,False
brittany19,williamsmatthew,False,Indeed husband happy serious.,1969-01-05,2020-08-11,True
matthewswayne,kaiserchristopher,False,Fear accept participant idea.,1963-03-21,2022-09-27,True
arivera,debbiecurtis,False,Past must may.,1972-06-08,2021-03-01,True
xaguirre,carl79,False,Always half very range.,1985-06-13,2022-10-09,True
awright,psampson,False,Tax herself lawyer.,1961-04-14,2023-03-08,False
otaylor,christopherperkins,False,Shake perform ok visit your.,1960-04-11,2021-05-14,False
chadalexander,smithbruce,True,Card wall card forward would.,2003-11-14,2020-04-20,True
brianna84,umedina,False,Avoid have test.,1940-12-04,2021-07-22,False
dawsonbrian,cassandra63,False,Set personal ahead build.,1962-04-26,2020-09-09,False
twells,brandinichols,False,Stock not almost.,1957-08-07,2022-10-31,False
nancyanderson,sharonporter,False,Fish finally middle outside.,1938-06-11,2023-03-30,False
gina98,wsmith,True,Paper finally head ago next.,1965-07-06,2022-01-14,True
dawnfox,stephen18,True,Security field development.,1950-04-16,2024-01-03,False
kstewart,megannorris,False,Court major billion yeah.,1947-12-24,2022-02-01,True
pam49,fosterlogan,False,Bit blood where heart month.,1976-01-07,2023-12-10,False
pamela71,chad59,False,Certain rate section teach.,1944-11-12,2023-05-17,True
david82,christina53,True,Add last throw.,1958-11-23,2023-04-30,True
qwoods,emily90,False,Goal claim hour board heart.,1949-06-26,2021-05-30,False
stephanie59,mark38,True,Individual but war strategy.,2005-12-28,2021-01-11,False
cantukristy,seanwatkins,True,Pattern let lose heart of.,1989-03-03,2020-06-05,True
christian55,dking,False,Bag anyone month deep.,1986-10-09,2024-02-18,True
zallen,gmiller,False,Decide window will treatment.,1947-01-23,2022-11-10,False
francisashley,atkinsdavid,True,Land citizen suggest evening.,1979-12-29,2022-02-21,False
danielle93,fchristensen,True,Her allow she town suddenly.,1968-11-10,2023-08-31,False
yhanna,bonniebrady,False,Term home after write sing.,2005-04-18,2023-06-19,True
murphyjoshua,sheamark,False,Although deal own deal owner.,1949-07-29,2021-03-14,True
williecampbell,spowell,False,That ready plant artist.,1959-11-19,2022-07-19,False
zacharycook,joneschad,False,Only court art prevent which.,1959-06-19,2023-01-10,False
marioyoung,chambersstephen,False,Bill responsibility star.,1971-08-26,2022-07-08,False
pearsonbrenda,hannah67,False,Continue figure deep others.,1973-05-25,2022-07-31,False
harpertaylor,hwalters,True,Computer offer start stuff.,1939-06-29,2024-04-16,True
davismary,josefox,False,Plan miss member must.,1959-02-27,2022-08-29,False
fischermario,andrea30,False,Safe trip TV exactly.,1987-08-12,2021-06-09,False
knightlynn,qarmstrong,False,Health girl once avoid.,1970-11-25,2024-04-04,True
fmack,gcooper,True,Few process even let until.,1994-04-28,2022-11-08,True
coffeyrebecca,vtaylor,True,Oil mouth say none lose.,1967-08-26,2022-11-28,True
mcdanielstephanie,marie43,True,Behind want as to father.,1958-02-03,2023-07-24,True
ronaldhayden,wanda11,True,Age five billion I gun.,2005-05-12,2023-12-14,True
pcruz,xmiller,True,Yes data will now.,1989-04-15,2021-03-12,True
jeffbrown,vickicarr,True,According yourself grow hold.,1987-05-24,2020-12-24,False
dorseytaylor,thomas77,False,Me focus six bar around.,1963-05-21,2022-10-02,False
saramarquez,ncooper,False,Modern how nearly.,1964-08-06,2020-07-31,False
kathyshields,qmills,True,Some single hour board.,1971-02-18,2023-06-21,True
osanders,westthomas,False,Market good personal him.,1949-05-06,2020-12-25,False
donnaperez,trichardson,True,Nor base stage body.,1966-08-06,2020-09-30,True
charlesphillip,crubio,False,Manager person girl show.,1974-10-19,2020-03-03,False
hlee,aliciajones,False,Scientist stuff yet would.,1949-07-07,2022-01-08,True
jameswright,wmitchell,True,Across coach third see.,1943-05-01,2021-10-20,True
shawn40,fgallagher,True,Benefit require eat area.,1969-01-06,2023-01-31,False
ethompson,cyu,True,That where few child.,1977-12-18,2023-07-09,True
omiller,julie43,True,About rise size fund a why.,1993-03-21,2023-05-21,False
gary50,kellijohnston,True,Our action order.,1940-04-27,2021-08-11,True
nkelley,karen45,True,Design me determine skin.,1991-11-07,2023-11-15,False
brightelizabeth,diana07,False,Same nice who upon.,1999-07-27,2021-08-07,False
tiffany72,david16,False,Around alone final window.,1960-05-04,2021-10-31,False
awilliams,gjohnson,True,Five list minute.,1970-04-09,2022-09-16,False
zwhite,katelynreed,True,Where modern possible.,2005-08-05,2022-06-18,False
gallen,edwardrodriguez,False,Charge offer measure goal.,1968-11-18,2021-03-18,False
bradbrewer,kkelly,False,Less religious bring travel.,1951-10-01,2024-02-18,False
david62,melissa59,True,Population market anyone our.,1967-10-09,2020-10-16,True
zcrawford,steven08,False,Under member first positive.,1968-08-04,2022-06-20,True
christopher88,jake71,False,Back sport hope know.,1952-05-31,2021-01-15,False
juanpatel,jeffrey26,False,Clearly learn way.,1972-09-03,2020-07-22,True
yhogan,waltertimothy,False,Growth site mention.,1994-02-05,2022-10-24,True
bdiaz,rbailey,True,Simply east shoulder gas.,1972-03-17,2022-03-24,True
glenn97,gcortez,True,Above heavy line.,1983-08-31,2021-11-29,True
isabella55,kristenlong,True,Break song trial industry.,1945-08-16,2023-08-16,False
emily62,amysmith,True,Try staff spend require.,1944-12-22,2021-09-14,False
ibailey,virginia20,True,Call ball way.,1981-01-06,2023-03-08,True
scottbenson,rebecca39,True,Site add star might me.,1986-10-31,2022-01-29,True
ugriffin,crawfordmeredith,False,Notice including his plant.,1978-04-30,2022-11-09,False
wandaandrews,vbailey,False,Break old artist color mean.,1967-04-26,2022-12-21,True
juliestephens,elliottchad,False,Billion industry we risk.,1989-01-03,2021-10-04,True
thomaspham,turnerdaniel,True,Possible assume eye up.,1982-01-24,2022-09-06,True
jameswiggins,sarahgeorge,False,Author thus without.,1954-03-02,2022-12-16,True
ygonzales,bradleyroach,False,Get almost hospital become.,1989-01-25,2020-12-02,False
shelby47,michaelmiller,True,Both candidate image man.,1958-07-26,2023-01-25,False
tammy37,juan66,False,Whom within town feel.,1961-08-15,2021-03-03,False
lopezgloria,pmitchell,True,Street easy someone often.,1995-01-17,2023-10-20,False
dylan33,saraproctor,False,Where on alone much minute.,1959-01-08,2023-11-12,True
heather27,kennethatkinson,True,Play spend building top with.,1977-05-19,2022-03-29,False
kaylaphelps,ohernandez,True,Military bad site here.,1992-08-29,2022-09-11,True
vwalton,barbarawelch,False,Either throw set.,1942-06-13,2020-04-12,True
tnelson,ecampbell,True,Half after order rule writer.,2001-11-11,2024-01-26,True
rpierce,katie18,True,Recent raise minute catch.,2000-02-07,2023-11-17,True
